title,url,instructor,rating,reviews_count,price,original_price,duration,lectures,level,bestseller
Complete AI Automation And Agentic AI Bootcamp With n8nBuild AI-driven automation and Agentic AI workflows using n8n with real-world projects.Rating: 4.5 out of 5439 reviews25.5 total hours157 lecturesAll LevelsCurrent price: $9.99Original price: $19.99,https://www.udemy.com/course/complete-ai-automation-and-agentic-ai-bootcamp-with-n8n/,"KRISHAI Technologies Private Limited, Mayank Aggarwal",Rating: 4.5 out of 54.5,439,$9.99,Original Price$19.99,25.5 total hours,157 lectures,All Levels,True
"Building AI Agents & Agentic AI System via Microsoft AutogenMaster Microsoft AutoGen to build powerful AI agents, automate tasks, and create advanced Agentic AI systems.Rating: 4.5 out of 5528 reviews39 total hours141 lecturesAll LevelsCurrent price: $9.99Original price: $19.99",https://www.udemy.com/course/building-ai-agents-agentic-ai-system-via-microsoft-autogen/,"KRISHAI Technologies Private Limited, Mayank Aggarwal, Krish Naik",Rating: 4.5 out of 54.5,528,$9.99,Original Price$19.99,39 total hours,141 lectures,All Levels,True
The Product Management for AI & Data Science CourseThe Complete Course for Becoming a Successful Product Manager in the Field of AI & Data ScienceRating: 4.5 out of 59476 reviews5 total hours68 lecturesAll LevelsCurrent price: $10.99Original price: $59.99,https://www.udemy.com/course/the-product-management-for-data-science-ai-course/,"365 Careers, Danielle Thé",Rating: 4.5 out of 54.5,"9,476",$10.99,Original Price$59.99,5 total hours,68 lectures,All Levels,True
"The AI Engineer Course 2026: Complete AI Engineer BootcampComplete AI Engineer Training: Python, NLP, Transformers, LLMs, LangChain, Hugging Face, APIsRating: 4.6 out of 515657 reviews29.5 total hours441 lecturesAll LevelsCurrent price: $9.99Original price: $59.99",https://www.udemy.com/course/the-ai-engineer-course-complete-ai-engineer-bootcamp/,365 Careers,Rating: 4.6 out of 54.6,"15,657",$9.99,Original Price$59.99,29.5 total hours,441 lectures,All Levels,True
Intro to AI: A Beginner's Guide to Artificial IntelligenceUnderstand How AI Works and How to Leverage This Technology to Transform Your Business and CareerRating: 4.5 out of 519288 reviews2.5 total hours43 lecturesAll LevelsCurrent price: $9.99Original price: $44.99,https://www.udemy.com/course/intro-to-ai-a-beginners-guide-to-artificial-intelligence/,365 Careers,Rating: 4.5 out of 54.5,"19,288",$9.99,Original Price$44.99,2.5 total hours,43 lectures,All Levels,True
"AI for Cyber Security : Threat Detection, SOC AutomationMaster the Basics of Artificial Intelligence in Cybersecurity – No Prior AI Knowledge NeededRating: 4.6 out of 5171 reviews23.5 total hours76 lecturesAll LevelsCurrent price: $9.99Original price: $19.99",https://www.udemy.com/course/ai-for-cybersecurity-threat-detection-soc-automation/,Selfcode Academy,Rating: 4.6 out of 54.6,171,$9.99,Original Price$19.99,23.5 total hours,76 lectures,All Levels,True
"AI for Human Resources, Talent Management Workforce PlanningUse AI to transform recruiting, people analytics, performance, and HR operations responsiblyRating: 3.9 out of 52 reviews2 total hours20 lecturesBeginnerCurrent price: $19.99",https://www.udemy.com/course/ai-for-human-resources-talent-management-workforce-planning/,Europe Hotel School,Rating: 3.9 out of 53.9,2,$19.99,,2 total hours,20 lectures,Beginner,True
"Introduction to AI, Machine Learning and Data ScienceIntroductory Course for Beginners to AI, Machine Learning, Data Science, Deep Learning, Supervised and Unsupervised MLRating: 3.9 out of 51039 reviews32 total mins15 lecturesBeginnerCurrent price: $10.99Original price: $19.99",https://www.udemy.com/course/introduction-to-ai-machine-learning-and-data-science/,Pradeep D,Rating: 3.9 out of 53.9,"1,039",$10.99,Original Price$19.99,,15 lectures,Beginner,True
"Artificial Intelligence for Finance, Accounting & AuditingGain hands-on skills using 8 AI techniques (no coding!), and position yourself for this digital age (Level 1)Rating: 4.5 out of 55463 reviews5.5 total hours73 lecturesBeginnerCurrent price: $9.99Original price: $49.99",https://www.udemy.com/course/artificial-intelligence-for-finance-accounting-auditing/,"AI Ascent LLC. Course Instructor: Dr. Ivy Munoko, Ph.D., ACCA, CISA",Rating: 4.5 out of 54.5,"5,463",$9.99,Original Price$49.99,5.5 total hours,73 lectures,Beginner,True
"The Absolute Beginners Guide to Artificial IntelligenceLearn the fundamentals of AI including Machine & Deep Learning, Natural Linguistic Processing, Neural networks and moreRating: 4.5 out of 5196 reviews4 total hours39 lecturesAll LevelsCurrent price: $9.99Original price: $19.99",https://www.udemy.com/course/the-absolute-beginners-guide-to-artificial-intelligence/,Alexander Oni,Rating: 4.5 out of 54.5,196,$9.99,Original Price$19.99,4 total hours,39 lectures,All Levels,True
AI Security with Microsoft Cloud (Azure & M365)SC-100 |SC-200 |SC-300 |SC-400 |MD-102 |Microsoft Purview |Entra ID |Microsoft Defender |Microsoft Sentinel|Azure OpenAIRating: 4.6 out of 588 reviews26.5 total hours138 lecturesIntermediateCurrent price: $9.99Original price: $49.99,https://www.udemy.com/course/securing-ai-with-microsoft-cloud/,Kuljot Singh Bakshi,Rating: 4.6 out of 54.6,88,$9.99,Original Price$49.99,26.5 total hours,138 lectures,Intermediate,True
AI Made AccessibleA Beginner's Guide with Hands-On Labs to Accelerate your Prompt Engineering SkillsRating: 4.6 out of 51026 reviews4 total hours34 lecturesBeginnerCurrent price: $9.99Original price: $19.99,https://www.udemy.com/course/ai-made-accessible/,"Penny de Byl, Penny Holistic3D",Rating: 4.6 out of 54.6,"1,026",$9.99,Original Price$19.99,4 total hours,34 lectures,Beginner,True
"Artificial Intelligence & Machine Learning for BusinessThe Ultimate Artificial Intelligence & Machine Learning course for CxOs, Managers, Team Leaders and EntrepreneursRating: 4.5 out of 524632 reviews6 total hours49 lecturesAll LevelsCurrent price: $10.99Original price: $69.99",https://www.udemy.com/course/artificial-intelligence-machine-learning-business/,Analytics Vidhya,Rating: 4.5 out of 54.5,"24,632",$10.99,Original Price$69.99,6 total hours,49 lectures,All Levels,True
"The Complete AI Data Training Course 2025Learn to create & evaluate human data for SFT, RLHF, and red-teaming while mastering AI data quality & safety standards.Rating: 4.5 out of 575 reviews2 total hours18 lecturesBeginnerCurrent price: $9.99Original price: $19.99",https://www.udemy.com/course/the-complete-ai-data-training-course/,Soar AI,Rating: 4.5 out of 54.5,75,$9.99,Original Price$19.99,2 total hours,18 lectures,Beginner,True
Artificial Intelligence and Machine Learning: Complete GuideDo you want to study AI and don't know where to start? You will learn everything you need to know in theory and practiceRating: 4.6 out of 5382 reviews22.5 total hours189 lecturesAll LevelsCurrent price: $9.99Original price: $19.99,https://www.udemy.com/course/artificial-intelligence-and-machine-learning-complete-guide/,"Jones Granatyr, AI Expert Academy",Rating: 4.6 out of 54.6,382,$9.99,Original Price$19.99,22.5 total hours,189 lectures,All Levels,True
"Fundamentals of Responsible Artificial Intelligence/MLDesigning and mantaining AI/ML models that help data subjects, are explainable, are not biased, and are compliant.Rating: 4.5 out of 51869 reviews22.5 total hours143 lecturesAll LevelsCurrent price: $9.99Original price: $34.99",https://www.udemy.com/course/responsible-ai-ml/,Vasco Patrício,Rating: 4.5 out of 54.5,"1,869",$9.99,Original Price$34.99,22.5 total hours,143 lectures,All Levels,True
"Artificial Intelligence A-Z 2026: Agentic AI, Gen AI, and RLCombine the power of Agentic AI, Generative AI, Reinforcement Learning to create powerful AI for Real-World applicationsRating: 4.4 out of 548950 reviews15.5 total hours128 lecturesAll LevelsCurrent price: $11.99Original price: $79.99",https://www.udemy.com/course/artificial-intelligence-az/,"Hadelin de Ponteves, Kirill Eremenko, SuperDataScience Team, Luka Anicin, Ligency ​",Rating: 4.4 out of 54.4,"48,950",$11.99,Original Price$79.99,15.5 total hours,128 lectures,All Levels,True
Intro to AI Agents and Agentic AIUnderstand How AI Agents Work and How to Leverage This Technology to Transform Your Business and CareerRating: 4.5 out of 528702 reviews2 total hours53 lecturesAll LevelsCurrent price: $9.99Original price: $19.99,https://www.udemy.com/course/intro-to-ai-agents-and-agentic-ai/,365 Careers,Rating: 4.5 out of 54.5,"28,702",$9.99,Original Price$19.99,2 total hours,53 lectures,All Levels,True
How to use Artificial Intelligence - A guide for everyone!Benefit today from the technology of tomorrow : Start using Artificial Intelligence to boost your productivity!Rating: 4.5 out of 518472 reviews2 total hours31 lecturesBeginnerCurrent price: $9.99Original price: $34.99,https://www.udemy.com/course/how-to-use-artificial-intelligence-a-guide-for-everyone/,Ahmed Fessi,Rating: 4.5 out of 54.5,"18,472",$9.99,Original Price$34.99,2 total hours,31 lectures,Beginner,True
"The AI Engineer Course 2026: Complete AI Engineer BootcampComplete AI Engineer Training: Python, NLP, Transformers, LLMs, LangChain, Hugging Face, APIsRating: 4.6 out of 515657 reviews29.5 total hours442 lecturesAll LevelsCurrent price: $9.99Original price: $59.99",https://www.udemy.com/course/the-ai-engineer-course-complete-ai-engineer-bootcamp/,365 Careers,Rating: 4.6 out of 54.6,"15,657",$9.99,Original Price$59.99,29.5 total hours,442 lectures,All Levels,True
AI for Everyone: Understanding and Applying the BasicsEmbark on Your AI Adventure: No Tech Background RequiredRating: 4.5 out of 513487 reviews3 total hours10 lecturesBeginnerCurrent price: $9.99Original price: $49.99,https://www.udemy.com/course/ai-bootcamp-guru/,Ritesh Vajariya,Rating: 4.5 out of 54.5,"13,487",$9.99,Original Price$49.99,3 total hours,10 lectures,Beginner,True
"AI for business - AI 101 fundamentals for managers & leadersMaster fundamentals of (Gen) AI as a manager, leverage opportunities with AI, and mitigate your people’s fears of AIRating: 4.5 out of 512206 reviews3 total hours44 lecturesBeginnerCurrent price: $9.99Original price: $29.99",https://www.udemy.com/course/ai-for-managers/,Axel Rittershaus,Rating: 4.5 out of 54.5,"12,206",$9.99,Original Price$29.99,3 total hours,44 lectures,Beginner,True
"Artificial Intelligence: Reinforcement Learning in PythonComplete guide to Reinforcement Learning, with Stock Trading and Online Advertising ApplicationsRating: 4.8 out of 510797 reviews14.5 total hours112 lecturesIntermediateCurrent price: $79.99",https://www.udemy.com/course/artificial-intelligence-reinforcement-learning-in-python/,"Lazy Programmer Team, Lazy Programmer Inc.",Rating: 4.8 out of 54.8,"10,797",$79.99,,14.5 total hours,112 lectures,Intermediate,True
Tensorflow Deep Learning - Data Science in PythonTensorflow Deep Learning Python : Tensorflow Neural Network Training : Tensorflow Models - Android Java : Tensorflow C#Rating: 4.4 out of 5303 reviews7.5 total hours71 lecturesAll LevelsCurrent price: $10.99Original price: $54.99,https://www.udemy.com/course/tensorflow-bootcamp-for-data-science-in-python/,Minerva Singh,Rating: 4.4 out of 54.4,303,$10.99,Original Price$54.99,7.5 total hours,71 lectures,All Levels,True
"Artificial Intelligence (ARS): Build the Most Powerful AILearn, build and implement the most powerful AI model at home. Compete with multi-billion dollars companies using ARS.Rating: 4.3 out of 51090 reviews5 total hours42 lecturesAll LevelsCurrent price: $10.99Original price: $54.99",https://www.udemy.com/course/artificial-intelligence-ars/,"Hadelin de Ponteves, Kirill Eremenko, SuperDataScience Team, Ligency ​",Rating: 4.3 out of 54.3,"1,090",$10.99,Original Price$54.99,5 total hours,42 lectures,All Levels,True
"Artificial Intelligence 2.0: AI, Python, DRL + ChatGPT PrizeArtificial Intelligence 2.0: The smartest combination of Double Deep Q-Learning, Policy Gradient, Actor Critic, DDPGRating: 4.6 out of 51357 reviews9.5 total hours65 lecturesBeginnerCurrent price: $17.99Original price: $109.99",https://www.udemy.com/course/deep-reinforcement-learning/,"Hadelin de Ponteves, SuperDataScience Team, Ligency ​",Rating: 4.6 out of 54.6,"1,357",$17.99,Original Price$109.99,9.5 total hours,65 lectures,Beginner,True
The Product Management for AI & Data Science CourseThe Complete Course for Becoming a Successful Product Manager in the Field of AI &amp; Data ScienceRating: 4.5 out of 59476 reviews5 total hours68 lecturesAll LevelsCurrent price: $10.99Original price: $59.99,https://www.udemy.com/course/the-product-management-for-data-science-ai-course/,"365 Careers, Danielle Thé",Rating: 4.5 out of 54.5,"9,476",$10.99,Original Price$59.99,5 total hours,68 lectures,All Levels,True
Artificial Intelligence Risk and Cyber Security Course 2026Learn how to govern and secure Artificial Intelligence and Machine Learning systemsRating: 4.4 out of 59084 reviews2 total hours17 lecturesBeginnerCurrent price: $9.99Original price: $34.99,https://www.udemy.com/course/artificial-intelligence-ai-governance-and-cyber-security/,Taimur Ijlal | Award winning cybersecurity leader and instructor,Rating: 4.4 out of 54.4,"9,084",$9.99,Original Price$34.99,2 total hours,17 lectures,Beginner,True
AI Fundamentals: Essential Guide to Artificial IntelligenceFuture-Proof Your Career: Learn AI Fundamentals and Thrive in a Rapidly Changing AI World. A Practical Intro to AI.Rating: 4.4 out of 55833 reviews2 total hours17 lecturesAll LevelsCurrent price: $9.99Original price: $29.99,https://www.udemy.com/course/ai-fundamentals-essential-guide-to-artificial-intelligence-course/,"Steve Ballinger, MBA",Rating: 4.4 out of 54.4,"5,833",$9.99,Original Price$29.99,2 total hours,17 lectures,All Levels,True
"Artificial Intelligence for Finance, Accounting & AuditingGain hands-on skills using 8 AI techniques (no coding!), and position yourself for this digital age (Level 1)Rating: 4.5 out of 55470 reviews5.5 total hours73 lecturesBeginnerCurrent price: $9.99Original price: $49.99",https://www.udemy.com/course/artificial-intelligence-for-finance-accounting-auditing/,"AI Ascent LLC. Course Instructor: Dr. Ivy Munoko, Ph.D., ACCA, CISA",Rating: 4.5 out of 54.5,"5,470",$9.99,Original Price$49.99,5.5 total hours,73 lectures,Beginner,True
Artificial Intelligence for Business + ChatGPT Prize [2026]Solve Real World Business Problems with AI Solutions implemented in Python. Code templates included.Rating: 4.3 out of 54963 reviews15 total hours119 lecturesBeginnerCurrent price: $11.99Original price: $74.99,https://www.udemy.com/course/ai-for-business/,"Hadelin de Ponteves, Kirill Eremenko, SuperDataScience Team, Ligency ​",Rating: 4.3 out of 54.3,"4,963",$11.99,Original Price$74.99,15 total hours,119 lectures,Beginner,True
"2026 Bootcamp: Generative AI, LLM Apps, AI Agents, Cursor AIFrom zero to professional level: learn the keys to Generative AI, LLM Apps, AI Agents, and Cursor AI.Rating: 4.3 out of 53839 reviews83 total hours798 lecturesBeginnerCurrent price: $9.99Original price: $54.99",https://www.udemy.com/course/bootcamp-generative-artificial-intelligence-and-llm-app-development/,Julio Colomer,Rating: 4.3 out of 54.3,"3,839",$9.99,Original Price$54.99,83 total hours,798 lectures,Beginner,True
"The Complete Artificial Intelligence (AI) for ProfessionalsLearn Google Gemini, ChatGPT SORA along with 100+ AI tools and use them to Master Business, Ethics and Innovation!Rating: 4.7 out of 53344 reviews14 total hours243 lecturesAll LevelsCurrent price: $9.99Original price: $19.99",https://www.udemy.com/course/the-complete-artificial-intelligence-ai-for-professionals/,"Dey Academy, IT & AI Dey Academy",Rating: 4.7 out of 54.7,"3,344",$9.99,Original Price$19.99,14 total hours,243 lectures,All Levels,True
The Beginner's Guide to Games AI with Unity 6.2+A practical guide to programming non-player characters for games in the Unity Game Engine with C#Rating: 4.5 out of 52838 reviews31 total hours183 lecturesBeginnerCurrent price: $10.99Original price: $74.99,https://www.udemy.com/course/artificial-intelligence-in-unity/,"Penny de Byl, Penny Holistic3D",Rating: 4.5 out of 54.5,"2,838",$10.99,Original Price$74.99,31 total hours,183 lectures,Beginner,True
"Artificial Intelligence Masterclass + ChatGPT Prize [2026]Enter the new era of Hybrid AI Models optimized by Deep NeuroEvolution, with a complete toolkit of ML, DL and AI models.Rating: 4.4 out of 52741 reviews12 total hours91 lecturesBeginnerCurrent price: $11.99Original price: $69.99",https://www.udemy.com/course/artificial-intelligence-masterclass/,"Hadelin de Ponteves, Kirill Eremenko, SuperDataScience Team, Ligency ​",Rating: 4.4 out of 54.4,"2,741",$11.99,Original Price$69.99,12 total hours,91 lectures,Beginner,True
"Modern Artificial Intelligence Masterclass: Build 6 ProjectsHarness the power of AI to solve practical, real-world problems in Finance, Tech, Art and HealthcareRating: 4.5 out of 52471 reviews16 total hours91 lecturesIntermediateCurrent price: $10.99Original price: $69.99",https://www.udemy.com/course/modern-artificial-intelligence-applications/,"Prof. Ryan Ahmed, Ph.D., MBA | 500,000+ Students | Best-Selling Instructor, SuperDataScience Team, Ligency ​",Rating: 4.5 out of 54.5,"2,471",$10.99,Original Price$69.99,16 total hours,91 lectures,Intermediate,True
"10 Days of No Code Artificial Intelligence BootcampBuild 10 AI projects in 10 days without coding using Google Teachable Machines, DataRobot, AWS Autopilot, and Vertex AIRating: 4.4 out of 52167 reviews12.5 total hours114 lecturesAll LevelsCurrent price: $9.99Original price: $59.99",https://www.udemy.com/course/10-code-less-days-of-artificial-intelligence/,"Prof. Ryan Ahmed, Ph.D., MBA | 500,000+ Students | Best-Selling Instructor, Ligency ​, SuperDataScience Team",Rating: 4.4 out of 54.4,"2,167",$9.99,Original Price$59.99,12.5 total hours,114 lectures,All Levels,True
"Data Science & AI Masters 2026 - From Python To Gen AIMaster Data Science and AI: Learn Python, EDA, Stats, SQL, Machine Learning, NLP, Deep Learning and Gen AIRating: 4.5 out of 52007 reviews105 total hours561 lecturesAll LevelsCurrent price: $9.99Original price: $54.99",https://www.udemy.com/course/data-science-ai-masters-from-python-to-gen-ai/,"Dr. Satyajit Pattnaik, Satyajit Pattnaik",Rating: 4.5 out of 54.5,"2,007",$9.99,Original Price$54.99,105 total hours,561 lectures,All Levels,True
"The Complete AI Coding Course (2025) - Cursor, Claude CodeLearn how to build any full-stack application with AI (Cursor AI, Claude Code, v0, ChatGPT, Replit) - Vibe Coding CourseRating: 4.5 out of 51883 reviews12 total hours128 lecturesAll LevelsCurrent price: $9.99Original price: $19.99",https://www.udemy.com/course/the-complete-ai-coding-course-2025-cursor-ai-v0-vercel/,Brendan AI,Rating: 4.5 out of 54.5,"1,883",$9.99,Original Price$19.99,12 total hours,128 lectures,All Levels,True
"Fundamental Guide to AI for ProfessionalsUnderstand AI, Machine Learning, Deep Learning & Generative AI through simple concepts & real-world examples.Rating: 4.7 out of 51847 reviews3 total hours21 lecturesBeginnerCurrent price: $9.99Original price: $19.99",https://www.udemy.com/course/fundamental-guide-ai-professionals/,IEM Learning,Rating: 4.7 out of 54.7,"1,847",$9.99,Original Price$19.99,3 total hours,21 lectures,Beginner,True
"Modern Artificial Intelligence with Zero CodingBuild 5 Practical Projects & Harness the Power of AI to solve practical, real-world business problems with Zero Coding!Rating: 4.5 out of 51809 reviews9.5 total hours70 lecturesBeginnerCurrent price: $10.99Original price: $74.99",https://www.udemy.com/course/modern-artificial-intelligence-with-zero-coding/,"Prof. Ryan Ahmed, Ph.D., MBA | 500,000+ Students | Best-Selling Instructor, Ligency ​, SuperDataScience Team",Rating: 4.5 out of 54.5,"1,809",$10.99,Original Price$74.99,9.5 total hours,70 lectures,Beginner,True
"Artificial Intelligence 2.0: AI, Python, DRL + ChatGPT PrizeArtificial Intelligence 2.0: The smartest combination of Double Deep Q-Learning, Policy Gradient, Actor Critic, DDPGRating: 4.6 out of 51358 reviews9.5 total hours65 lecturesBeginnerCurrent price: $17.99Original price: $109.99",https://www.udemy.com/course/deep-reinforcement-learning/,"Hadelin de Ponteves, SuperDataScience Team, Ligency ​",Rating: 4.6 out of 54.6,"1,358",$17.99,Original Price$109.99,9.5 total hours,65 lectures,Beginner,True
AI Security EssentialsSecuring Artificial Intelligence SystemsRating: 4.2 out of 51347 reviews2.5 total hours8 lecturesIntermediateCurrent price: $9.99Original price: $19.99,https://www.udemy.com/course/ai-security-essentials/,Francis Gorman,Rating: 4.2 out of 54.2,"1,347",$9.99,Original Price$19.99,2.5 total hours,8 lectures,Intermediate,True
AI SecurityMicrosoft Security Copilot | ChatGPT | MITRE ATLAS | Defender for AIRating: 4.5 out of 51315 reviews10 total hours166 lecturesAll LevelsCurrent price: $9.99Original price: $49.99,https://www.udemy.com/course/ai-security-cn/,Christopher Nett | 80.000+ Enrollments Worldwide,Rating: 4.5 out of 54.5,"1,315",$9.99,Original Price$49.99,10 total hours,166 lectures,All Levels,True
"AI best practices for people manager and team membersSupercharge AI utilization, boost productivity, copy Generative AI best practices & use cases, live an AI First mindsetRating: 4.4 out of 51132 reviews5 total hours59 lecturesAll LevelsCurrent price: $9.99Original price: $19.99",https://www.udemy.com/course/ai-best-practices/,Axel Rittershaus,Rating: 4.4 out of 54.4,"1,132",$9.99,Original Price$19.99,5 total hours,59 lectures,All Levels,True
The Ultimate ChatGPT Generative AI CourseLearn how to become a Prompt Engineer!Rating: 4.4 out of 51097 reviews1 total hour19 lecturesBeginnerCurrent price: $9.99Original price: $19.99,https://www.udemy.com/course/the-ultimate-chatgpt-generative-ai-course/,Frantz Merine,Rating: 4.4 out of 54.4,"1,097",$9.99,Original Price$19.99,1 total hour,19 lectures,Beginner,True
"Introduction to AI, Machine Learning and Data ScienceIntroductory Course for Beginners to AI, Machine Learning, Data Science, Deep Learning, Supervised and Unsupervised MLRating: 3.9 out of 51039 reviews0.5 total hours15 lecturesBeginnerCurrent price: $10.99Original price: $19.99",https://www.udemy.com/course/introduction-to-ai-machine-learning-and-data-science/,Pradeep D,Rating: 3.9 out of 53.9,"1,039",$10.99,Original Price$19.99,0.5 total hours,15 lectures,Beginner,True
