title,url,instructor,rating,reviews_count,price,original_price,duration,lectures,level,bestseller
Communication in Management & Leadership: Complete GuideThe Complete Communication Skills Toolkit for Leaders and ManagersRating: 4.8 out of 572 reviews3 total hours51 lecturesAll LevelsCurrent price: $9.99Original price: $19.99,https://www.udemy.com/course/communication-management/,"CRFT Productions, Chris Croft",Rating: 4.8 out of 54.8,72,$9.99,Original Price$19.99,3 total hours,51 lectures,All Levels,False
Complete New Manager Toolkit: First 100 DaysStep by step practical guide for how to lead from day one as a New ManagerRating: 5.0 out of 518 reviews3 total hours50 lecturesAll LevelsCurrent price: $9.99Original price: $19.99,https://www.udemy.com/course/new-manager-100/,"CRFT Productions, Chris Croft",Rating: 5.0 out of 55.0,18,$9.99,Original Price$19.99,3 total hours,50 lectures,All Levels,False
The Power of Deep Listening (Using Active Listening Skills)Relationship Skills | Empathy Training | Influencing Skills | Build Trust | Communication Skills | How to ListenRating: 4.6 out of 57476 reviews4 total hours46 lecturesAll LevelsCurrent price: $10.99Original price: $74.99,https://www.udemy.com/course/the-power-of-deep-listening/,"Roger Kay Allen, Ph.D.",Rating: 4.6 out of 54.6,"7,476",$10.99,Original Price$74.99,4 total hours,46 lectures,All Levels,False
Communication Skills: Communication Skills for BeginnersEffective Communication + Storytelling to Improve Presentations & Public Speaking for Beginners | Course Lang. - HindiRating: 4.5 out of 5881 reviews10 total hours109 lecturesBeginnerCurrent price: $9.99Original price: $19.99,https://www.udemy.com/course/communication-skills-storytelling-communication-tips/,"Kritikka Tripathi, MBA, Certified Counsellor",Rating: 4.5 out of 54.5,881,$9.99,Original Price$19.99,10 total hours,109 lectures,Beginner,False
Public Relations: Media Crisis CommunicationsPublic Relations: You Can Shape and Control Your Media Messages at The Worst Possible TimesRating: 4.5 out of 54077 reviews6.5 total hours127 lecturesAll LevelsCurrent price: $10.99Original price: $69.99,https://www.udemy.com/course/crisis-communications-how-to-survive-a-crisis-in-the-media/,"TJ Walker, Media Training Worldwide Digital",Rating: 4.5 out of 54.5,"4,077",$10.99,Original Price$69.99,6.5 total hours,127 lectures,All Levels,False
"Industry-Ready Professional: Essential Soft SkillsBuilding Mindset, Communication, Emotional Intelligence, and Professional Excellence for the Modern WorkplaceRating: 4.5 out of 51 review5 total hours37 lecturesBeginnerCurrent price: $9.99Original price: $19.99",https://www.udemy.com/course/industry-ready-professional-essential-soft-skills/,C seshu,Rating: 4.5 out of 54.5,1,$9.99,Original Price$19.99,5 total hours,37 lectures,Beginner,False
"Communicating through DisagreementMaster Conflict Resolution: Navigate Disagreements, Enhance Emotional Intelligence, Foster Empathy, and Develop CommunicRating: 3.8 out of 5182 reviews17 total hours350 lecturesBeginnerCurrent price: $9.99Original price: $19.99",https://www.udemy.com/course/communicating-through-disagreement/,"Peter Alkema, Irlon Terblanche, Media Training Worldwide Digital",Rating: 3.8 out of 53.8,182,$9.99,Original Price$19.99,17 total hours,350 lectures,Beginner,False
Communication Skills Masterclass: A Blueprint for Home/WorkCommunication Skills | Leadership | Relationship Skills | Management Skills | Emotional Intelligence | ListeningRating: 4.7 out of 5656 reviews6 total hours57 lecturesAll LevelsCurrent price: $9.99Original price: $39.99,https://www.udemy.com/course/communication-skills-masterclass-a-blueprint-for-homework/,"Roger Kay Allen, Ph.D.",Rating: 4.7 out of 54.7,656,$9.99,Original Price$39.99,6 total hours,57 lectures,All Levels,False
Management Skills Masterclass - Management & LeadershipManagement Skills | Leadership | Teamwork | Team Management | Communication Skill for Managers | Manager TrainingRating: 4.7 out of 5995 reviews10.5 total hours86 lecturesAll LevelsCurrent price: $9.99Original price: $34.99,https://www.udemy.com/course/management-skill/,Salil Dhawan,Rating: 4.7 out of 54.7,995,$9.99,Original Price$34.99,10.5 total hours,86 lectures,All Levels,False
The Top Ten Techniques to Quick Rapport with AnyoneDiscover the Secrets to Building Rapport from a Global Behavioral Expert and FBI Master Spy RecruiterRating: 4.6 out of 546 reviews1.5 total hours27 lecturesAll LevelsCurrent price: $10.99Original price: $49.99,https://www.udemy.com/course/the-top-ten-techniques-to-quick-rapport/,Robin Dreeke,Rating: 4.6 out of 54.6,46,$10.99,Original Price$49.99,1.5 total hours,27 lectures,All Levels,False
"How to give and receive feedback effectivelyGiving and receiving feedback, communication, influence, leadership, persuasion and dealing with difficult peopleRating: 4.4 out of 55676 reviews1 total hour30 lecturesAll LevelsCurrent price: $9.99Original price: $44.99",https://www.udemy.com/course/give-and-receive-feedback/,Jamal Lazaar,Rating: 4.4 out of 54.4,"5,676",$9.99,Original Price$44.99,1 total hour,30 lectures,All Levels,False
Job Interviewing Skills Course: Pass Any Job Interview!Create an Unforgettable First Impression and Answer Any Questions with Ease by Mastering Your Job Interviewing Skills.Rating: 4.6 out of 522 reviews4 total hours71 lecturesAll LevelsCurrent price: $10.99Original price: $19.99,https://www.udemy.com/course/job-interviewing-skills-course-pass-any-job-interview/,"Voiceover Masterclass, Peter Baker",Rating: 4.6 out of 54.6,22,$10.99,Original Price$19.99,4 total hours,71 lectures,All Levels,False
"How to Master Your Online Interview Skills - Complete GuideLearn how to present yourself in a confident, positive and professional way during your next Online InterviewRating: 4.6 out of 541 reviews5 total hours70 lecturesAll LevelsCurrent price: $9.99Original price: $19.99",https://www.udemy.com/course/how-to-master-your-online-interview-skills-complete-guide/,Marcel Riemer,Rating: 4.6 out of 54.6,41,$9.99,Original Price$19.99,5 total hours,70 lectures,All Levels,False
Complete Job Interviewing Skills with Real Life ExamplesDevelop job interviewing skills with real-life examples to land your dream job and stand out in today’s marketRating: 4.7 out of 52113 reviews3 total hours53 lecturesAll LevelsCurrent price: $10.99Original price: $49.99,https://www.udemy.com/course/complete-job-interview-skills-with-real-life-examples/,Imran Afzal,Rating: 4.7 out of 54.7,"2,113",$10.99,Original Price$49.99,3 total hours,53 lectures,All Levels,False
Interview Success - Crack BPO interviews Like a PROFace BPO interviews like a pro. Build your confidence and excel with ease.Rating: 4.8 out of 52 reviews39 total hours180 lecturesAll LevelsCurrent price: $9.99Original price: $19.99,https://www.udemy.com/course/the-win-program-win-interviews-naturally/,Rajkumar Bharathy A,Rating: 4.8 out of 54.8,2,$9.99,Original Price$19.99,39 total hours,180 lectures,All Levels,False
Communication Fundamentals: How To Communicate BetterBecome an Effective Communicator And Learn How to Get Your Message Across By Learning Communication FundamentalsRating: 4.5 out of 5140461 reviews1.5 total hours38 lecturesAll LevelsCurrent price: $10.99Original price: $39.99,https://www.udemy.com/course/communication-fundamentals-how-to-communicate-better/,"Life Progression Project, Dr. Lorraine Wiseman, PhD",Rating: 4.5 out of 54.5,"140,461",$10.99,Original Price$39.99,1.5 total hours,38 lectures,All Levels,False
Write Better Emails: Tactics for Smarter Team CommunicationHow to improve your email writing skills to save time & improve communication with your team; easy business writing tipsRating: 4.6 out of 595706 reviews1.5 total hours23 lecturesAll LevelsCurrent price: $10.99Original price: $54.99,https://www.udemy.com/course/write-better-emails/,Hassan Osman,Rating: 4.6 out of 54.6,"95,706",$10.99,Original Price$54.99,1.5 total hours,23 lectures,All Levels,False
"Cross-Cultural Communication: How To Flex Your StyleCross-Cultural Communication: Using Language Appropriately, Expressions, Gestures & Cues, Cultural Profiles & more!Rating: 4.4 out of 562577 reviews1 total hour32 lecturesAll LevelsCurrent price: $10.99Original price: $44.99",https://www.udemy.com/course/cross-cultural-communication-how-to-flex-your-style/,"Life Progression Project, Dr. Lorraine Wiseman, PhD",Rating: 4.4 out of 54.4,"62,577",$10.99,Original Price$44.99,1 total hour,32 lectures,All Levels,False
"Smart Tips: CommunicationA collection of 61 micro-lessons on effective communication, presentation skills, feedback, and complex conversationsRating: 4.6 out of 537138 reviews3 total hours61 lecturesAll LevelsCurrent price: $199.99",https://www.udemy.com/course/communicatebrilliantly/,Deborah Grayson Riegel,Rating: 4.6 out of 54.6,"37,138",$199.99,,3 total hours,61 lectures,All Levels,False
"The Complete Communication Skills Master Class for LifeCommunication Skills for Persuasion, Assertiveness and All Business Communication NeedsRating: 4.5 out of 533801 reviews36.5 total hours713 lecturesAll LevelsCurrent price: $9.99Original price: $69.99",https://www.udemy.com/course/the-complete-communication-skills-master-class-for-life/,TJ Walker,Rating: 4.5 out of 54.5,"33,801",$9.99,Original Price$69.99,36.5 total hours,713 lectures,All Levels,False
Tactics for Tackling Difficult People in Life and WorkRecognise and use four key skills of self-empowerment when faced with difficult behaviourRating: 4.6 out of 521683 reviews1 total hour11 lecturesAll LevelsCurrent price: $11.99Original price: $44.99,https://www.udemy.com/course/tackling-difficult-people-with-barry-winbolt-msc/,"Barry Winbolt, Skill Boosters",Rating: 4.6 out of 54.6,"21,683",$11.99,Original Price$44.99,1 total hour,11 lectures,All Levels,False
12 Strategies for Dealing With Difficult PeopleLearn how to confidently implement different strategies for dealing with difficult people.Rating: 4.5 out of 519669 reviews2 total hours18 lecturesAll LevelsCurrent price: $13.99Original price: $49.99,https://www.udemy.com/course/12-strategies-for-dealing-with-difficult-people/,Steve Schmidt,Rating: 4.5 out of 54.5,"19,669",$13.99,Original Price$49.99,2 total hours,18 lectures,All Levels,False
The Art of Communications - Become A Master CommunicatorCommunication skills training. Confidence. Public Speaking. Promotion. Body Language. Pay raise. Job interview. Speech.Rating: 4.5 out of 517113 reviews3 total hours42 lecturesAll LevelsCurrent price: $10.99Original price: $49.99,https://www.udemy.com/course/the-art-of-communications/,"Dr. Roy Naraine, Adam Naraine, Jimmy Naraine • Official Udemy Partner",Rating: 4.5 out of 54.5,"17,113",$10.99,Original Price$49.99,3 total hours,42 lectures,All Levels,False
"Communication Skills: Become Clear, Concise, ConfidentLearn to sound more credible and and convincing with this hands-on course.Rating: 4.6 out of 515820 reviews1 total hour9 lecturesAll LevelsCurrent price: $10.99Original price: $39.99",https://www.udemy.com/course/clear-concise-confident/,Alex Lyon,Rating: 4.6 out of 54.6,"15,820",$10.99,Original Price$39.99,1 total hour,9 lectures,All Levels,False
Communication Skills for ProfessionalsLearn the Top 5 essential communication skills that every professional should put into practice.Rating: 4.6 out of 513738 reviews0.5 total hours7 lecturesAll LevelsCurrent price: $10.99Original price: $44.99,https://www.udemy.com/course/essential-communication-skills-for-professionals/,Alex Lyon,Rating: 4.6 out of 54.6,"13,738",$10.99,Original Price$44.99,0.5 total hours,7 lectures,All Levels,False
The Essential Guide for Effective ManagersMaster flexible leadership and effective communication to build your leadership brand AND drive performanceRating: 4.5 out of 510940 reviews1.5 total hours35 lecturesBeginnerCurrent price: $10.99Original price: $19.99,https://www.udemy.com/course/the-essential-guide-for-effective-managers/,Marie Deveaux,Rating: 4.5 out of 54.5,"10,940",$10.99,Original Price$19.99,1.5 total hours,35 lectures,Beginner,False
"Communication Skills Machine: Master Persuasion & InfluenceLearn the Communication Skills to Master the Secrets of Persuasion, Influence, & Assertiveness for Business & Life.Rating: 4.4 out of 510241 reviews2.5 total hours20 lecturesAll LevelsCurrent price: $10.99Original price: $44.99",https://www.udemy.com/course/communicationskillsmachine/,Patrick Dang,Rating: 4.4 out of 54.4,"10,241",$10.99,Original Price$44.99,2.5 total hours,20 lectures,All Levels,False
Communication Skills for BeginnersStart Building Your Communication Skills NowRating: 4.6 out of 58305 reviews36.5 total hours721 lecturesBeginnerCurrent price: $11.99Original price: $74.99,https://www.udemy.com/course/communication-skills-for-beginners-d/,TJ Walker,Rating: 4.6 out of 54.6,"8,305",$11.99,Original Price$74.99,36.5 total hours,721 lectures,Beginner,False
"Digital Diversity/Cyber-Citizen/Cross-Cultural CommunicationLearn Global Leadership, Communications, Listening, and Conflict Management Skills for TeamsRating: 4.5 out of 58243 reviews2 total hours50 lecturesAll LevelsCurrent price: $10.99Original price: $44.99",https://www.udemy.com/course/cross-cultural-communication-the-new-global-currency/,Elizabeth C. Pagé,Rating: 4.5 out of 54.5,"8,243",$10.99,Original Price$44.99,2 total hours,50 lectures,All Levels,False
The Complete Business Communication MasterclassImprove your productivity and relationships in the workplace through the hidden secrets of communication!Rating: 4.6 out of 57836 reviews3 total hours24 lecturesBeginnerCurrent price: $9.99Original price: $44.99,https://www.udemy.com/course/business-communication-course-irina-ketkin/,Irina Ketkin,Rating: 4.6 out of 54.6,"7,836",$9.99,Original Price$44.99,3 total hours,24 lectures,Beginner,False
"Communication, Leadership & Management - 3 in 1 MasterclassLearn Communication &amp; Leadership Skills For Inspiration, Success In Life, Work PLUS Management Skills For Career SuccessRating: 4.6 out of 57712 reviews56.5 total hours669 lecturesBeginnerCurrent price: $10.99Original price: $69.99",https://www.udemy.com/course/high-impact-communication-skills/,Peter Alkema,Rating: 4.6 out of 54.6,"7,712",$10.99,Original Price$69.99,56.5 total hours,669 lectures,Beginner,False
"Advanced agile communication skills for 21st Century leadersUpgrade your skills for Industry 4.0 by discovering how to lead using information, communication & control (agile)Rating: 4.5 out of 57575 reviews3.5 total hours31 lecturesAll LevelsCurrent price: $84.99",https://www.udemy.com/course/advancedcommunicationskills/,Leadapreneur Academy,Rating: 4.5 out of 54.5,"7,575",$84.99,,3.5 total hours,31 lectures,All Levels,False
Communication Skills: Acquire Effective CommunicationMaster Communication Skills: Effective Communication is essential in both professional and personal life.Rating: 4.5 out of 57545 reviews5.5 total hours83 lecturesAll LevelsCurrent price: $9.99Original price: $49.99,https://www.udemy.com/course/communication-skills-acquire-effective-communication/,Meritshot Academy,Rating: 4.5 out of 54.5,"7,545",$9.99,Original Price$49.99,5.5 total hours,83 lectures,All Levels,False
The Power of Deep Listening (Using Active Listening Skills)Relationship Skills | Empathy Training | Influencing Skills | Build Trust | Communication Skills | How to ListenRating: 4.6 out of 57487 reviews4 total hours46 lecturesAll LevelsCurrent price: $10.99Original price: $74.99,https://www.udemy.com/course/the-power-of-deep-listening/,"Roger Kay Allen, Ph.D.",Rating: 4.6 out of 54.6,"7,487",$10.99,Original Price$74.99,4 total hours,46 lectures,All Levels,False
Communications for New ManagersLearn from an Emmy-Award Winner and a #1 LinkedIn Instructor on developing effective leadership communications skills.Rating: 4.6 out of 57256 reviews0.5 total hours11 lecturesBeginnerCurrent price: $9.99Original price: $19.99,https://www.udemy.com/course/communications-for-new-managers/,Jessica Chen,Rating: 4.6 out of 54.6,"7,256",$9.99,Original Price$19.99,0.5 total hours,11 lectures,Beginner,False
Persuasion Masterclass: How To Powerfully Influence AnyoneMaster The 3 Hidden Skills of the Most Persuasive People Without Manipulation In 10 Minutes A Day …Guaranteed!Rating: 4.5 out of 56764 reviews3 total hours42 lecturesAll LevelsCurrent price: $11.99Original price: $69.99,https://www.udemy.com/course/persuasion-masterclass-how-to-powerfully-influence-anyone/,"Brandon Hakim, Insider School",Rating: 4.5 out of 54.5,"6,764",$11.99,Original Price$69.99,3 total hours,42 lectures,All Levels,False
"Leadership Communication Skills for Influence and ImpactDevelop the communication skills that will make you irreplaceable, influential and unstoppable as a 21st century leader.Rating: 4.6 out of 54398 reviews6.5 total hours41 lecturesAll LevelsCurrent price: $10.99Original price: $59.99",https://www.udemy.com/course/communication-skills-for-leadership-and-management-influence/,"Kain Ramsay, Jason Cask",Rating: 4.6 out of 54.6,"4,398",$10.99,Original Price$59.99,6.5 total hours,41 lectures,All Levels,False
"Effective communications skills for business (updated 2025)Master Business Communication: Speak, Write, and Connect with ConfidenceRating: 4.0 out of 53967 reviews1 total hour10 lecturesBeginnerCurrent price: $9.99Original price: $19.99",https://www.udemy.com/course/effective-communications-skills-for-business/,David Inman FRICS CEnv,Rating: 4.0 out of 54.0,"3,967",$9.99,Original Price$19.99,1 total hour,10 lectures,Beginner,False
"Leadership Through The Art Of Masterful CommunicationBecome an empowered leader, achieve your highest levels of performance, and influence others with supreme confidence.Rating: 4.6 out of 53958 reviews2 total hours12 lecturesAll LevelsCurrent price: $10.99Original price: $39.99",https://www.udemy.com/course/the-art-of-masterful-communication/,Adam Piandes,Rating: 4.6 out of 54.6,"3,958",$10.99,Original Price$39.99,2 total hours,12 lectures,All Levels,False
Communicating with Confidence: 15 Ways to up your game15 ways to elevate your influence at work and beyondRating: 4.6 out of 53786 reviews1 total hour28 lecturesAll LevelsCurrent price: $9.99Original price: $19.99,https://www.udemy.com/course/communicating-with-confidence/,Diane Flynn,Rating: 4.6 out of 54.6,"3,786",$9.99,Original Price$19.99,1 total hour,28 lectures,All Levels,False
Mastering Intercultural communicationUnlock the Secrets to Effective Communication with Diverse CulturesRating: 4.5 out of 53667 reviews1.5 total hours17 lecturesAll LevelsCurrent price: $10.99Original price: $19.99,https://www.udemy.com/course/intercultural-communication/,Amaro Araujo,Rating: 4.5 out of 54.5,"3,667",$10.99,Original Price$19.99,1.5 total hours,17 lectures,All Levels,False
"Communication Skills FundamentalsCommunication skills in the workplace. Verbal and written communication, active listening & intercultural communicationRating: 4.5 out of 53281 reviews2 total hours34 lecturesAll LevelsCurrent price: $9.99Original price: $19.99",https://www.udemy.com/course/communication-skills-fundamentals/,Jamal Lazaar,Rating: 4.5 out of 54.5,"3,281",$9.99,Original Price$19.99,2 total hours,34 lectures,All Levels,False
"How To Make A Great First ImpressionA beginners guide to using eye contact, your smile, a handshake and your words to make a GREAT first impression.Rating: 4.5 out of 53213 reviews0.5 total hours5 lecturesBeginnerCurrent price: $10.99Original price: $19.99",https://www.udemy.com/course/how-to-make-a-great-first-impression/,DAVID HYNER.  psae fpsa flpi fism alam abnlp,Rating: 4.5 out of 54.5,"3,213",$10.99,Original Price$19.99,0.5 total hours,5 lectures,Beginner,False
"Communication Skills : Mastering CommunicationCommunication Skills, Business Communication, Presentation Skills, Public Speaking, Leadership, Management SkillsRating: 4.6 out of 53210 reviews8.5 total hours93 lecturesAll LevelsCurrent price: $9.99Original price: $19.99",https://www.udemy.com/course/communication-skills-mastering-communication/,Levent Ertunalılar,Rating: 4.6 out of 54.6,"3,210",$9.99,Original Price$19.99,8.5 total hours,93 lectures,All Levels,False
"Winning Communication Skills for Telephone, Conference CallsImprove Communication Skills - Use the Telephone Effectively! Avoid Phone Etiquette Blunders that AnnoyRating: 4.0 out of 52945 reviews33.5 total hours711 lecturesAll LevelsCurrent price: $10.99Original price: $64.99",https://www.udemy.com/course/telephone-conference-calls-workplace-communication-skills/,"TJ Walker, Media Training Worldwide Digital",Rating: 4.0 out of 54.0,"2,945",$10.99,Original Price$64.99,33.5 total hours,711 lectures,All Levels,False
Communication Skills for the Global WorkplacePractical Communication SkillsRating: 4.6 out of 52886 reviews6 total hours73 lecturesIntermediateCurrent price: $9.99Original price: $29.99,https://www.udemy.com/course/communication-skills-for-the-global-workplace/,Jamie Dixon,Rating: 4.6 out of 54.6,"2,886",$9.99,Original Price$29.99,6 total hours,73 lectures,Intermediate,False
