title,url,instructor,rating,reviews_count,price,original_price,duration,lectures,level,bestseller
"Character Drawing Masterclass: Character Drawing Art SchoolCharacter Drawing Course To Learn Drawing, Character Design, Sketching and Art Skills While Mastering Character Drawing.Rating: 4.5 out of 522 reviews30.5 total hours78 lecturesAll LevelsCurrent price: $9.99Original price: $19.99",https://www.udemy.com/course/drawing-character-masterclass/,Skillet Academy,Rating: 4.5 out of 54.5,22,$9.99,Original Price$19.99,30.5 total hours,78 lectures,All Levels,False
"Essential Drawing Course For Beginner To AdvancedDrawing Animals, Drawing With Numbers, Drawing with Letters, Drawing Face and Figures, Drawing Nature, Face and FiguresRating: 4.3 out of 571 reviews3.5 total hours12 lecturesBeginnerCurrent price: $9.99Original price: $39.99",https://www.udemy.com/course/essential-drawing-course-for-beginner-to-advanced/,Zechariah Tech,Rating: 4.3 out of 54.3,71,$9.99,Original Price$39.99,3.5 total hours,12 lectures,Beginner,False
The Art & Science of Drawing / SHADING FUNDAMENTALSLearn how to draw using dramatic light and shadow.Rating: 4.7 out of 51790 reviews1.5 total hours5 lecturesAll LevelsCurrent price: $13.99Original price: $69.99,https://www.udemy.com/course/the-art-science-of-drawing-shading-fundamentals/,Brent Eviston,Rating: 4.7 out of 54.7,"1,790",$13.99,Original Price$69.99,1.5 total hours,5 lectures,All Levels,False
The Art & Science of Drawing / CONTOURSLearn to create compelling contour drawings and how to draw using foreshortening!Rating: 4.8 out of 51386 reviews1.5 total hours5 lecturesBeginnerCurrent price: $13.99Original price: $54.99,https://www.udemy.com/course/the-art-science-of-drawing-contours/,Brent Eviston,Rating: 4.8 out of 54.8,"1,386",$13.99,Original Price$54.99,1.5 total hours,5 lectures,Beginner,False
The Art & Science of Drawing / DYNAMIC MARK MAKINGCreate compelling drawings using expressive mark making.Rating: 4.7 out of 53193 reviews1.5 total hours7 lecturesBeginnerCurrent price: $10.99Original price: $59.99,https://www.udemy.com/course/the-art-science-of-drawing-week-two-dynamic-mark-making/,Brent Eviston,Rating: 4.7 out of 54.7,"3,193",$10.99,Original Price$59.99,1.5 total hours,7 lectures,Beginner,False
Head Drawing Fundamentals Made SimpleHow to Draw Realistic Portraits & Faces Step-by-Step / Sketch People & Facial Features For BeginnersRating: 4.5 out of 52987 reviews6 total hours36 lecturesAll LevelsCurrent price: $10.99Original price: $69.99,https://www.udemy.com/course/portrait-drawing-fundamentals-made-simple/,Ethan Nguyen,Rating: 4.5 out of 54.5,"2,987",$10.99,Original Price$69.99,6 total hours,36 lectures,All Levels,False
From Drawing To Illustration (2021 Edition)Learn how to draw characters and scenes to create professional illustrations.Rating: 3.9 out of 592 reviews5.5 total hours32 lecturesBeginner,https://www.udemy.com/course/from-drawing-to-illustration/,Brendon Schumacker,Rating: 3.9 out of 53.9,92,,,5.5 total hours,32 lectures,Beginner,False
【Eng dub】Japanese Anime & Manga Character Illustration TipsIllustration Tips from an Industry Veteran in Japan (Beginner to Advanced)Rating: 3.8 out of 59 reviews1.5 total hours17 lecturesAll LevelsCurrent price: $9.99Original price: $19.99,https://www.udemy.com/course/japanese-anime-manga-character-illustration-tips/,G-angle Learning,Rating: 3.8 out of 53.8,9,$9.99,Original Price$19.99,1.5 total hours,17 lectures,All Levels,False
How To Draw Manga & Anime Easily & QuicklyGo from beginner to drawing excellent Manga & Anime characters with easy to follow tutorials.Rating: 4.0 out of 5324 reviews1 total hour27 lecturesAll LevelsCurrent price: $10.99Original price: $19.99,https://www.udemy.com/course/how-to-draw-manga-anime/,Drew Williams,Rating: 4.0 out of 54.0,324,$10.99,Original Price$19.99,1 total hour,27 lectures,All Levels,False
How to Draw Sonic the Hedgehog  I Cartoon Drawing AnimationDrawing for BeginnersRating: 4.8 out of 533 reviews1 total hour7 lecturesBeginnerCurrent price: $9.99Original price: $19.99,https://www.udemy.com/course/how-to-draw-sonic-the-hedgehog-i-cartoon-drawing-animation/,"Enrique Plazola, Artem Dulub",Rating: 4.8 out of 54.8,33,$9.99,Original Price$19.99,1 total hour,7 lectures,Beginner,False
"The Best for Anime Faces Drawing , Coloring and InkingAnime drawing by easy ways  | learn to draw anime faces | using pencils , pens and colored pencils | tutorialRating: 4.5 out of 528 reviews7 total hours27 lecturesBeginnerCurrent price: $9.99Original price: $19.99",https://www.udemy.com/course/drawing-anime-faces-by-pencils-for-beginners/,Jamal Ghoneim,Rating: 4.5 out of 54.5,28,$9.99,Original Price$19.99,7 total hours,27 lectures,Beginner,False
"The Ultimate Drawing Course - Beginner to AdvancedLearn the #1 most important building block of all art, Drawing. This course will teach you how to draw like a pro!Rating: 4.6 out of 5125700 reviews11 total hours64 lecturesBeginnerCurrent price: $9.99Original price: $69.99",https://www.udemy.com/course/the-ultimate-drawing-course-beginner-to-advanced/,"Jaysen Batchelor, Quinton Batchelor",Rating: 4.6 out of 54.6,"125,700",$9.99,Original Price$69.99,11 total hours,64 lectures,Beginner,False
"Character Art School: The Complete Character Drawing CourseLearn How to Draw People and Character Designs Professionally, Drawing for Animation, Comics, Cartoons, Games and More!Rating: 4.6 out of 566366 reviews28.5 total hours118 lecturesBeginnerCurrent price: $9.99Original price: $69.99",https://www.udemy.com/course/character-art-school-complete-character-drawing/,"Scott Harris, Art Director & Lead Instructor",Rating: 4.6 out of 54.6,"66,366",$9.99,Original Price$69.99,28.5 total hours,118 lectures,Beginner,False
The Art & Science of Drawing / BASIC SKILLSDrawing is not a talent. It's a skill anyone can learn.Rating: 4.7 out of 515634 reviews4.5 total hours17 lecturesBeginnerCurrent price: $10.99Original price: $69.99,https://www.udemy.com/course/the-art-and-science-of-drawing/,Brent Eviston,Rating: 4.7 out of 54.7,"15,634",$10.99,Original Price$69.99,4.5 total hours,17 lectures,Beginner,False
How to Draw and Sketch for Absolute Beginners pt 1Learn the Basics of Sketching and DrawingRating: 4.3 out of 55340 reviews13 total hours111 lecturesBeginnerCurrent price: $9.99Original price: $69.99,https://www.udemy.com/course/drawing-and-sketching-for-beginners/,Rich Graysonn,Rating: 4.3 out of 54.3,"5,340",$9.99,Original Price$69.99,13 total hours,111 lectures,Beginner,False
"Perspective Art School: The Complete Drawing CourseLearn How To Draw Landscapes, How to Draw Perspective, How to Draw Backgrounds and How to Draw Scenes for your Worlds.Rating: 4.7 out of 55284 reviews10 total hours51 lecturesBeginnerCurrent price: $10.99Original price: $69.99",https://www.udemy.com/course/perspective-art-school-environment-landscape-drawing-course/,"Scott Harris, Art Director & Lead Instructor",Rating: 4.7 out of 54.7,"5,284",$10.99,Original Price$69.99,10 total hours,51 lectures,Beginner,False
The Secrets to DrawingA comprehensive video and ebook course designed for people wanting to learn the core concepts of drawing.Rating: 4.5 out of 54367 reviews5.5 total hours28 lecturesBeginnerCurrent price: $10.99Original price: $64.99,https://www.udemy.com/course/the-secrets-to-drawing/,Matthew Fussell,Rating: 4.5 out of 54.5,"4,367",$10.99,Original Price$64.99,5.5 total hours,28 lectures,Beginner,False
"Drawing Masterclass: Art, Sketching, Drawing CourseDrawing Course: Learn to Draw, Art, Sketching, Illustration, Character Design, Digital Drawing, Pencil Drawing, FigureRating: 4.3 out of 53568 reviews26.5 total hours128 lecturesAll LevelsCurrent price: $13.99Original price: $79.99",https://www.udemy.com/course/drawing-masterclass/,"Phil Ebiner, Kevin Gardin, Mitchell Bouchard, Video School, Red Cape Learning",Rating: 4.3 out of 54.3,"3,568",$13.99,Original Price$79.99,26.5 total hours,128 lectures,All Levels,False
The Art & Science of Drawing / FORM & SPACELearn to draw in 3-DimensionsRating: 4.9 out of 53294 reviews3 total hours11 lecturesAll LevelsCurrent price: $9.99Original price: $49.99,https://www.udemy.com/course/the-art-science-of-drawing-weeks-3-4-form-space/,Brent Eviston,Rating: 4.9 out of 54.9,"3,294",$9.99,Original Price$49.99,3 total hours,11 lectures,All Levels,False
"The Complete Drawing Masterclass: From Beginner to AdvancedApply the art and practice of the fundamental skill of drawing, to bring your drawings to life in this ultimate course.Rating: 4.2 out of 53235 reviews20 total hours125 lecturesBeginnerCurrent price: $10.99Original price: $59.99",https://www.udemy.com/course/complete-drawing-course/,"Chad Neuman, Ph.D., Jonathan Simon, BFA, MFA",Rating: 4.2 out of 54.2,"3,235",$10.99,Original Price$59.99,20 total hours,125 lectures,Beginner,False
"The Art & Science of Figure Drawing: GESTURELearn everything you need to know about drawing dynamic, expressive figures.Rating: 4.7 out of 54920 reviews13.5 total hours47 lecturesBeginnerCurrent price: $9.99Original price: $69.99",https://www.udemy.com/course/figuredrawing/,Brent Eviston,Rating: 4.7 out of 54.7,"4,920",$9.99,Original Price$69.99,13.5 total hours,47 lectures,Beginner,False
Building Confidence Through Drawing: Art for BeginnersThis Course is Intended for Purchase by Adults. 33 Directed Drawing Lessons for Beginners.Rating: 4.6 out of 52198 reviews5 total hours32 lecturesBeginnerCurrent price: $10.99Original price: $74.99,https://www.udemy.com/course/building-kids-confidence-through-drawing-art-for-children/,Em Winn,Rating: 4.6 out of 54.6,"2,198",$10.99,Original Price$74.99,5 total hours,32 lectures,Beginner,False
The Complete Beginners Drawing and Shading CourseThe ideal drawing course for beginners to advanced. Super easy pencil drawing method. Everything explained in detail.Rating: 4.6 out of 51967 reviews10.5 total hours97 lecturesBeginnerCurrent price: $10.99Original price: $69.99,https://www.udemy.com/course/beginners-drawing-course/,Cindy Wider,Rating: 4.6 out of 54.6,"1,967",$10.99,Original Price$69.99,10.5 total hours,97 lectures,Beginner,False
"Masterclass of Realistic Drawing and Shading Human FeaturesRealistic Human Feature Drawing, Hachure and Shading with Pencil, Charcoal and Brush Techniques - Beginner to AdvancedRating: 4.2 out of 51942 reviews29.5 total hours79 lecturesAll LevelsCurrent price: $10.99Original price: $69.99",https://www.udemy.com/course/masterclass-of-realistic-drawing-and-shading-human-features/,"Ian Xiang, Ava Moradi",Rating: 4.2 out of 54.2,"1,942",$10.99,Original Price$69.99,29.5 total hours,79 lectures,All Levels,False
The Ultimate Animal Drawing Course - beginner to advancedLearn the #1 most important building block of all artRating: 4.6 out of 51919 reviews11 total hours62 lecturesBeginnerCurrent price: $10.99Original price: $74.99,https://www.udemy.com/course/the-ultimate-animal-drawing-course-beginner-to-advanced/,"Jaysen Batchelor, Quinton Batchelor",Rating: 4.6 out of 54.6,"1,919",$10.99,Original Price$74.99,11 total hours,62 lectures,Beginner,False
The Ultimate Face & Head Drawing Course - for beginnersDrawing the human face made simple!Rating: 4.7 out of 51896 reviews9 total hours43 lecturesBeginnerCurrent price: $10.99Original price: $74.99,https://www.udemy.com/course/the-ultimate-face-head-drawing-course-for-beginners/,"Jaysen Batchelor, Quinton Batchelor",Rating: 4.7 out of 54.7,"1,896",$10.99,Original Price$74.99,9 total hours,43 lectures,Beginner,False
From Drawing To Illustration (2021 Edition)Learn how to draw characters and scenes to create professional illustrations.Rating: 3.9 out of 592 reviews5.5 total hours32 lecturesBeginnerCurrent price: $10.99Original price: $19.99,https://www.udemy.com/course/from-drawing-to-illustration/,Brendon Schumacker,Rating: 3.9 out of 53.9,92,$10.99,Original Price$19.99,5.5 total hours,32 lectures,Beginner,False
The Art & Science of Drawing / SHADING FUNDAMENTALSLearn how to draw using dramatic light and shadow.Rating: 4.7 out of 51791 reviews1.5 total hours5 lecturesAll LevelsCurrent price: $13.99Original price: $69.99,https://www.udemy.com/course/the-art-science-of-drawing-shading-fundamentals/,Brent Eviston,Rating: 4.7 out of 54.7,"1,791",$13.99,Original Price$69.99,1.5 total hours,5 lectures,All Levels,False
How to Draw Heads - Step by Step - From Any AngleThis course will teach you how to draw male and female comic style heads in a variety of ways.Rating: 4.6 out of 51660 reviews18.5 total hours102 lecturesAll LevelsCurrent price: $10.99Original price: $64.99,https://www.udemy.com/course/how-to-draw-heads-step-by-step-from-any-angle/,Robert Marzullo,Rating: 4.6 out of 54.6,"1,660",$10.99,Original Price$64.99,18.5 total hours,102 lectures,All Levels,False
The Art & Science of Drawing / MEASURING & PROPORTIONDramatically increase the accuracy of your drawings.Rating: 4.6 out of 51622 reviews1.5 total hours5 lecturesBeginnerCurrent price: $10.99Original price: $39.99,https://www.udemy.com/course/the-art-science-of-drawing-week-5-measuring-proportion/,Brent Eviston,Rating: 4.6 out of 54.6,"1,622",$10.99,Original Price$39.99,1.5 total hours,5 lectures,Beginner,False
"Drawing and Sketching for BeginnersMaster Drawing from Scratch: Easy, Engaging Drawing Lessons for Newbies!Rating: 4.2 out of 51536 reviews3 total hours39 lecturesBeginnerCurrent price: $10.99Original price: $54.99",https://www.udemy.com/course/sketching-for-beginners/,Robin Slee | Art | Illustration | iPad | Software Development,Rating: 4.2 out of 54.2,"1,536",$10.99,Original Price$54.99,3 total hours,39 lectures,Beginner,False
Drawing Fundamentals 1: Basic Skills & Sketching AccuratelySketching & Drawing Basics For the Absolute Beginners. Learn to See and Draw Anything Accurately!Rating: 4.7 out of 51464 reviews3 total hours30 lecturesBeginnerCurrent price: $10.99Original price: $54.99,https://www.udemy.com/course/drawing-fundamentals-1/,Ethan Nguyen,Rating: 4.7 out of 54.7,"1,464",$10.99,Original Price$54.99,3 total hours,30 lectures,Beginner,False
The Art & Science of Drawing / CONTOURSLearn to create compelling contour drawings and how to draw using foreshortening!Rating: 4.8 out of 51387 reviews1.5 total hours5 lecturesBeginnerCurrent price: $13.99Original price: $54.99,https://www.udemy.com/course/the-art-science-of-drawing-contours/,Brent Eviston,Rating: 4.8 out of 54.8,"1,387",$13.99,Original Price$54.99,1.5 total hours,5 lectures,Beginner,False
The Complete Art Fundamentals CourseUnlock Your Artistic Potential: Learn Essential Drawing and Painting FoundationsRating: 4.4 out of 51278 reviews1 total hour24 lecturesBeginnerCurrent price: $10.99Original price: $54.99,https://www.udemy.com/course/art-fundamentals-drawing-and-painting-essentials/,"Scott Harris, Art Director & Lead Instructor",Rating: 4.4 out of 54.4,"1,278",$10.99,Original Price$54.99,1 total hour,24 lectures,Beginner,False
"Discover How to Draw and paint ComicsLearn to draw and paint; from your imagination, guaranteed.Rating: 4.3 out of 51136 reviews62 total hours85 lecturesAll LevelsCurrent price: $10.99Original price: $54.99",https://www.udemy.com/course/learn-to-draw-and-paint/,Neil Fontaine,Rating: 4.3 out of 54.3,"1,136",$10.99,Original Price$54.99,62 total hours,85 lectures,All Levels,False
How to Draw Ep.1 - BASIC DRAWING SKILLS & Sketching CourseLearn to draw & sketch - drawing basics for beginners w/ exciting 3D sketching exercises to develop your drawing skillsRating: 4.7 out of 51128 reviews3.5 total hours32 lecturesBeginnerCurrent price: $10.99Original price: $54.99,https://www.udemy.com/course/how-to-draw-101-basic-drawing-skills-sketching-exercises/,Tamas Benko,Rating: 4.7 out of 54.7,"1,128",$10.99,Original Price$54.99,3.5 total hours,32 lectures,Beginner,False
How To Draw BASICS for Kids and beginners!This Course is Intended For Purchase By AdultsRating: 4.6 out of 51083 reviews3 total hours18 lecturesBeginnerCurrent price: $9.99Original price: $59.99,https://www.udemy.com/course/how-to-draw-basics-for-kids/,"Ed Foychuk, Joey Foychuk",Rating: 4.6 out of 54.6,"1,083",$9.99,Original Price$59.99,3 total hours,18 lectures,Beginner,False
Art for Beginners: 17 Easy Drawing & Painting LessonsThis Course is Intended for Purchase by Adults. Students Will Learn How to Draw and Watercolor Paint 17 Cute Animals!Rating: 4.7 out of 51030 reviews3.5 total hours62 lecturesBeginnerCurrent price: $11.99Original price: $64.99,https://www.udemy.com/course/art-for-kids-drawing-and-painting-course-for-young-children/,Em Winn,Rating: 4.7 out of 54.7,"1,030",$11.99,Original Price$64.99,3.5 total hours,62 lectures,Beginner,False
Drawing for Beginners: How to Draw Cartoons Step-By-StepThis Course is Intended for Purchase by Adults. How to Draw 80+ Easy Cartoons Step-by-Step!Rating: 4.5 out of 5979 reviews6.5 total hours89 lecturesBeginnerCurrent price: $11.99Original price: $69.99,https://www.udemy.com/course/drawing-for-kids-how-to-draw-step-by-step-interactive-art/,Em Winn,Rating: 4.5 out of 54.5,979,$11.99,Original Price$69.99,6.5 total hours,89 lectures,Beginner,False
The Art & Science of Drawing / SHADING: BEYOND THE BASICSLearn to take your shading skills from basic to advanced.Rating: 4.9 out of 5967 reviews1.5 total hours5 lecturesAll LevelsCurrent price: $10.99Original price: $49.99,https://www.udemy.com/course/the-art-science-of-drawing-shading-beyond-the-basics/,Brent Eviston,Rating: 4.9 out of 54.9,967,$10.99,Original Price$49.99,1.5 total hours,5 lectures,All Levels,False
Learn to Draw From Your Imagination - Step by StepLearn how to take ideas from your head and draw them on paperRating: 4.6 out of 5918 reviews9 total hours46 lecturesAll LevelsCurrent price: $10.99Original price: $39.99,https://www.udemy.com/course/ultimate-guide-to-drawing-from-your-imagination-step-by-step/,"Jaysen Batchelor, Quinton Batchelor",Rating: 4.6 out of 54.6,918,$10.99,Original Price$39.99,9 total hours,46 lectures,All Levels,False
Complete Drawing Course: Create Video Game Concept ArtLearn To Be An Artist From Scratch - Follow Along Digitally or With Pen and Paper.Rating: 4.6 out of 5878 reviews13.5 total hours89 lecturesBeginnerCurrent price: $10.99Original price: $74.99,https://www.udemy.com/course/learn-how-to-draw-for-game-developers-and-artists/,"GameDev.tv Team, Grant Abbitt",Rating: 4.6 out of 54.6,878,$10.99,Original Price$74.99,13.5 total hours,89 lectures,Beginner,False
"Draw Islamic Geometric Patterns With A Compass And RulerLearn to Construct, Outline, Tile And Interlace Five Different Patterns.Rating: 4.8 out of 5831 reviews1.5 total hours14 lecturesBeginnerCurrent price: $9.99Original price: $34.99",https://www.udemy.com/course/islamic-geometry-using-a-compass-straight-edge/,Samira Mian,Rating: 4.8 out of 54.8,831,$9.99,Original Price$34.99,1.5 total hours,14 lectures,Beginner,False
