title,url,instructor,rating,reviews_count,price,original_price,duration,lectures,level,bestseller
Ethical Hacking Complete Course Zero to ExpertHack computer systems like black hat hackers using professional tools and master the hacker mindset that questions allRating: 4.5 out of 5140 reviews27.5 total hours152 lecturesAll LevelsCurrent price: $9.99Original price: $19.99,https://www.udemy.com/course/ethical-hacking-complete-course-zero-to-expert/,Jolanda de Koff,Rating: 4.5 out of 54.5,140,$9.99,Original Price$19.99,27.5 total hours,152 lectures,All Levels,False
Website Hacking / Penetration TestingHack websites and web applications like black hat hackers and secure them like experts.Rating: 4.5 out of 522572 reviews10.5 total hours101 lecturesAll LevelsCurrent price: $11.99Original price: $79.99,https://www.udemy.com/course/learn-website-hacking-penetration-testing-from-scratch/,"Zaid Sabih, z Security",Rating: 4.5 out of 54.5,"22,572",$11.99,Original Price$79.99,10.5 total hours,101 lectures,All Levels,False
Learn Ethical Hacking From ScratchBecome an ethical hacker that can hack like black hat hackers and secure systems like cybersecurity expertsRating: 4.6 out of 5135423 reviews15 total hours143 lecturesAll LevelsCurrent price: $9.99Original price: $64.99,https://www.udemy.com/course/learn-ethical-hacking-from-scratch/,"Zaid Sabih, z Security",Rating: 4.6 out of 54.6,"135,423",$9.99,Original Price$64.99,15 total hours,143 lectures,All Levels,False
"The Complete Ethical Hacking Course: Beginner to Advanced!Learn how to do ethical hacking, penetration testing, web testing, and wifi hacking using kali linux!Rating: 4.5 out of 529811 reviews24.5 total hours113 lecturesAll Levels",https://www.udemy.com/course/penetration-testing/,"Ermin Kreponic, Aldin Omerdic",Rating: 4.5 out of 54.5,"29,811",,,24.5 total hours,113 lectures,All Levels,False
Website Hacking / Penetration TestingHack websites and web applications like black hat hackers and secure them like experts.Rating: 4.6 out of 522575 reviews10.5 total hours101 lecturesAll LevelsCurrent price: $11.99Original price: $79.99,https://www.udemy.com/course/learn-website-hacking-penetration-testing-from-scratch/,"Zaid Sabih, z Security",Rating: 4.6 out of 54.6,"22,575",$11.99,Original Price$79.99,10.5 total hours,101 lectures,All Levels,False
Complete Ethical Hacking BootcampLearn Ethical Hacking + Penetration Testing! Use real techniques by black hat hackers then learn to defend against them!Rating: 4.6 out of 518960 reviews29 total hours255 lecturesAll LevelsCurrent price: $9.99Original price: $64.99,https://www.udemy.com/course/complete-ethical-hacking-bootcamp-zero-to-mastery/,"Andrei Neagoie, Aleksa Tamburkovski",Rating: 4.6 out of 54.6,"18,960",$9.99,Original Price$64.99,29 total hours,255 lectures,All Levels,False
"Learn Ethical Hacking: Beginner to AdvancedLearn ethical hacking, penetration testing and network security skills with our comprehensive course!Rating: 4.2 out of 55690 reviews29 total hours149 lecturesAll Levels",https://www.udemy.com/course/ethical-hacking-kali-linux/,Joseph Delgadillo,Rating: 4.2 out of 54.2,"5,690",,,29 total hours,149 lectures,All Levels,False
The Complete Ethical Hacking CourseProtect yourself from hackers & cyberattacks. Learn penetration testing + build security and coding tools with Python.Rating: 4.5 out of 55529 reviews41.5 total hours388 lecturesAll Levels,https://www.udemy.com/course/the-complete-ethical-hacking-course/,"Codestars • over 2.5 million students worldwide!, Atil Samancioglu",Rating: 4.5 out of 54.5,"5,529",,,41.5 total hours,388 lectures,All Levels,False
Network Ethical Hacking for beginners (Kali - Hands-on)Learn How Hackers Think! & Secure Your Systems Like Security Experts.Rating: 4.2 out of 53828 reviews3.5 total hours39 lecturesAll Levels,https://www.udemy.com/course/network-ethical-hacking/,Hamza Sheikh,Rating: 4.2 out of 54.2,"3,828",,,3.5 total hours,39 lectures,All Levels,False
The Complete Ethical Hacking Course!Learn how to get started as a professional hacker with this complete course!Rating: 4.3 out of 53740 reviews19.5 total hours98 lecturesAll Levels,https://www.udemy.com/course/ethical-hacking-professional/,Joseph Delgadillo,Rating: 4.3 out of 54.3,"3,740",,,19.5 total hours,98 lectures,All Levels,False
Intro to Bug Bounty Hunting and Web Application HackingInsiders guide to ethical web hacking and bug bounty hunting with Ben Sadeghipour (@NahamSec)Rating: 4.6 out of 53586 reviews12 total hours125 lecturesBeginner,https://www.udemy.com/course/intro-to-bug-bounty-by-nahamsec/,Ben Sadeghipour,Rating: 4.6 out of 54.6,"3,586",,,12 total hours,125 lectures,Beginner,False
Network Hacking Continued - Intermediate to AdvancedLearn advanced techniques to hack into WiFi &amp; wired networks &amp; implement custom MITM attacksRating: 4.6 out of 53562 reviews10 total hours83 lecturesIntermediateCurrent price: $10.99Original price: $69.99,https://www.udemy.com/course/network-hacking-continued-intermediate-to-advanced/,"Zaid Sabih, z Security",Rating: 4.6 out of 54.6,"3,562",$10.99,Original Price$69.99,10 total hours,83 lectures,Intermediate,False
"Learn Ethical Hacking From A-Z: Beginner To Expert CourseLearn how to become an elite ethical hacker and easily hack networks, computer systems, web apps and so much more...Rating: 4.3 out of 53481 reviews12 total hours103 lecturesAll Levels",https://www.udemy.com/course/learn-ethical-hacking-from-a-z-beginner-to-expert-course/,"Juan E. Galvan, Anthony Timbers",Rating: 4.3 out of 54.3,"3,481",,,12 total hours,103 lectures,All Levels,False
The Complete Ethical Hacking Course for 2016/2017!Gain the knowledge hackers use to compromise systems and use it to protect your own!Rating: 4.5 out of 53341 reviews16 total hours92 lecturesAll Levels,https://www.udemy.com/course/hacking-complete/,"Ermin Kreponic, Aldin Omerdic",Rating: 4.5 out of 54.5,"3,341",,,16 total hours,92 lectures,All Levels,False
Hacking in Practice: Intensive Ethical Hacking MEGA CourseNEW Edition! Practical Ethical Hacking Techniques. The most intensive ethical hacking course. Over 27+ HOURS OF VIDEO.Rating: 4.2 out of 53269 reviews21 total hours246 lecturesAll Levels,https://www.udemy.com/course/hacking-in-practice-intensive-ethical-hacking-mega-course/,"IT Security Academy, Hacking School",Rating: 4.2 out of 54.2,"3,269",,,21 total hours,246 lectures,All Levels,False
Complete Ethical Hacking Masterclass: Go from Zero to HeroThe only course you need to learn Ethical Hacking. Hack computer system like a black hat hacker and secure them like proRating: 3.9 out of 53157 reviews130 total hours558 lecturesAll LevelsCurrent price: $9.99Original price: $49.99,https://www.udemy.com/course/top-course/,Best Hacking Course,Rating: 3.9 out of 53.9,"3,157",$9.99,Original Price$49.99,130 total hours,558 lectures,All Levels,False
"Real-World Ethical Hacking: Hands-on CybersecurityProtect yourself, gain the hottest new job skills, and learn the tricks the bad guys use - with Kali Linux & Metasploit!Rating: 4.7 out of 52849 reviews11 total hours98 lecturesBeginnerCurrent price: $10.99Original price: $64.99",https://www.udemy.com/course/real-world-ethical-hacking/,Bryson Payne,Rating: 4.7 out of 54.7,"2,849",$10.99,Original Price$64.99,11 total hours,98 lectures,Beginner,False
"The Complete Android Ethical Hacking Practical Course C|AEHP100%  Hands-On Real World  Practical Approach on Android Ethical Hacking. Learn to Prevent FACEBOOK , INSTAGRAM hacking!Rating: 4.4 out of 52311 reviews6 total hours97 lecturesAll Levels",https://www.udemy.com/course/the-complete-android-ethical-hacking-practical-course-caehp/,"Dey Academy, IT & AI Dey Academy",Rating: 4.4 out of 54.4,"2,311",,,6 total hours,97 lectures,All Levels,False
Build Undetectable Malware Using C Language: Ethical HackingIn This Advance Ethical Hacking Course You Will Learn How To Create Your Own Penetration Testing Tool With C ProgrammingRating: 4.5 out of 51493 reviews3 total hours23 lecturesExpertCurrent price: $10.99Original price: $64.99,https://www.udemy.com/course/build-undetectable-malware-using-c-language-ethical-hacking/,"Aleksa Tamburkovski, Joe Parys",Rating: 4.5 out of 54.5,"1,493",$10.99,Original Price$64.99,3 total hours,23 lectures,Expert,False
Website Hacking / Penetration TestingHack websites and web applications like black hat hackers and secure them like experts.Rating: 4.5 out of 522575 reviews10.5 total hours101 lecturesAll LevelsCurrent price: $11.99Original price: $79.99,https://www.udemy.com/course/learn-website-hacking-penetration-testing-from-scratch/,"Zaid Sabih, z Security",Rating: 4.5 out of 54.5,"22,575",$11.99,Original Price$79.99,10.5 total hours,101 lectures,All Levels,False
Android App Hacking - Black Belt EditionBecoming the lead expert in android app securityRating: 4.8 out of 51018 reviews54.5 total hours138 lecturesAll LevelsCurrent price: $9.99Original price: $54.99,https://www.udemy.com/course/android-app-hacking-black-belt-edition/,Roman Stuehler,Rating: 4.8 out of 54.8,"1,018",$9.99,Original Price$54.99,54.5 total hours,138 lectures,All Levels,False
The Black Terminal: Hacking Basics to Real-World ScenariosMaster ethical hacking from basics to advanced real-world attacks with hands-on practical labs and tools.Rating: 4.8 out of 593 reviews18 total hours166 lecturesAll LevelsCurrent price: $9.99Original price: $19.99,https://www.udemy.com/course/the-black-terminal-hacking-basics-to-real-world-scenarios/,Atharva Pawar,Rating: 4.8 out of 54.8,93,$9.99,Original Price$19.99,18 total hours,166 lectures,All Levels,False
Complete Ethical Hacking Bundle: 5 Courses in 1Learn and understand hacking and cyber threats with one complete course bundle.Rating: 3.6 out of 510 reviews4.5 total hours100 lecturesAll LevelsCurrent price: $9.99Original price: $19.99,https://www.udemy.com/course/complete-ethical-hacking-bundle/,Juravlea Nicolae,Rating: 3.6 out of 53.6,10,$9.99,Original Price$19.99,4.5 total hours,100 lectures,All Levels,False
"Ethical Hacking for Mobile Phones, Facebook & Social Media!Complete Guide to systems, phones and Facebook hacking with Kali Linux, using client exploitation techniques.Rating: 3.5 out of 5724 reviews1.5 total hours12 lecturesBeginnerCurrent price: $14.99Original price: $39.99",https://www.udemy.com/course/advanced-real-world-hacking-with-practical-videos/,Snehil Khare,Rating: 3.5 out of 53.5,724,$14.99,Original Price$39.99,1.5 total hours,12 lectures,Beginner,False
The Complete Ethical Hacking Course 2.0: Python & Kali LinuxLearn how to become an Ethical Hacker using Python and use Kali Linux to perform penetration testing on networksRating: 4.2 out of 5691 reviews11 total hours71 lecturesAll LevelsCurrent price: $10.99Original price: $39.99,https://www.udemy.com/course/penetration-testing-ethical-hacking-course-python-kali-linux/,"ClayDesk E-learning, Syed Raza, Ali Bokhari, Qasim Shah",Rating: 4.2 out of 54.2,691,$10.99,Original Price$39.99,11 total hours,71 lectures,All Levels,False
"Ultimate Python - ML, AI, Speech Recognition & moreMaster the Python Programming Language! Learn Speech Recognition, Data Science, Game Dev, Hacking, Automation, and more!Rating: 4.3 out of 568 reviews18 total hours476 lecturesAll LevelsCurrent price: $10.99Original price: $59.99",https://www.udemy.com/course/complete-python-programming-course-beginner-to-expert/,Robert Gioia,Rating: 4.3 out of 54.3,68,$10.99,Original Price$59.99,18 total hours,476 lectures,All Levels,False
Coding Botnet & Backdoor In Python For Ethical Hacking!Create An Advance Botnet and Backdoor & Keylogger That Will Be Able To Maintain Multiple Connections SimultaneouslyRating: 4.4 out of 5132 reviews5 total hours29 lecturesAll LevelsCurrent price: $10.99Original price: $54.99,https://www.udemy.com/course/coding-botnet-backdoor-in-python-for-ethical-hacking/,Aleksa Tamburkovski,Rating: 4.4 out of 54.4,132,$10.99,Original Price$54.99,5 total hours,29 lectures,All Levels,False
Learn Python & Ethical Hacking From ScratchWrite 20+ hacking programs to learn hacking and programming at the same time | No prior knowledge requiredRating: 4.5 out of 521246 reviews25 total hours185 lecturesAll LevelsCurrent price: $9.99Original price: $64.99,https://www.udemy.com/course/learn-python-and-ethical-hacking-from-scratch/,"Zaid Sabih, z Security",Rating: 4.5 out of 54.5,"21,246",$9.99,Original Price$64.99,25 total hours,185 lectures,All Levels,False
Complete Ethical Hacking Masterclass: Go from Zero to HeroThe only course you need to learn Ethical Hacking. Hack computer system like a black hat hacker and secure them like proRating: 3.9 out of 53156 reviews130 total hours558 lecturesAll LevelsCurrent price: $9.99Original price: $49.99,https://www.udemy.com/course/top-course/,Best Hacking Course,Rating: 3.9 out of 53.9,"3,156",$9.99,Original Price$49.99,130 total hours,558 lectures,All Levels,False
"Learn Social Engineering From ScratchHack secure accounts and computers (Windows, Apple Mac OS, Linux and Android) and secure yourself from hackersRating: 4.7 out of 56254 reviews12.5 total hours111 lecturesAll LevelsCurrent price: $10.99Original price: $74.99",https://www.udemy.com/course/learn-social-engineering-from-scratch/,"Zaid Sabih, z Security",Rating: 4.7 out of 54.7,"6,254",$10.99,Original Price$74.99,12.5 total hours,111 lectures,All Levels,False
64-Bit Assembly & Shellcoding for Ethical HackersMastering 64-Bit Assembly and Advanced Shellcoding Techniques for Ethical Hacking and Penetration testingRating: 4.8 out of 565 reviews21 total hours83 lecturesIntermediateCurrent price: $9.99Original price: $19.99,https://www.udemy.com/course/64-bit-assembly-shellcoding-for-ethical-hackers/,Swapnil Singh,Rating: 4.8 out of 54.8,65,$9.99,Original Price$19.99,21 total hours,83 lectures,Intermediate,False
"Practical Web Application Penetration Testing (WAPT)Learn how to find, exploit and explain 40+ security issues in Web Applications.Rating: 4.7 out of 584 reviews19.5 total hours112 lecturesBeginnerCurrent price: $9.99Original price: $19.99",https://www.udemy.com/course/practical-wapt/,Leonardo Tamiano,Rating: 4.7 out of 54.7,84,$9.99,Original Price$19.99,19.5 total hours,112 lectures,Beginner,False
"Penetration Testing and Ethical Hacking Complete Hands-onEthical Hacking, Penetration Testing (Pentest+), Bug Bounty, Metasploit , Free Hacking Tools as Nmap for ethical hackerRating: 4.5 out of 52218 reviews19.5 total hours265 lecturesAll LevelsCurrent price: $11.99Original price: $79.99",https://www.udemy.com/course/hands-on-complete-penetration-testing-and-ethical-hacking/,"Muharrem AYDIN, OAK Academy Team",Rating: 4.5 out of 54.5,"2,218",$11.99,Original Price$79.99,19.5 total hours,265 lectures,All Levels,False
Build an Advanced Keylogger using C++ for Ethical Hacking!Take this course to learn how to code a fully functional keylogger in C++ for use in Windows!Rating: 4.0 out of 52153 reviews7.5 total hours35 lecturesIntermediateCurrent price: $10.99Original price: $39.99,https://www.udemy.com/course/how-to-create-an-advanced-keylogger-from-scratch-for-windows/,"Ermin Kreponic, Aldin Omerdic",Rating: 4.0 out of 54.0,"2,153",$10.99,Original Price$39.99,7.5 total hours,35 lectures,Intermediate,False
Complete Ethical Hacking & Cyber Security Masterclass CourseIn this complete ethical hacking & cyber security master class course you will learn ethical hacking from scratchRating: 4.6 out of 52096 reviews13.5 total hours85 lecturesAll LevelsCurrent price: $11.99Original price: $64.99,https://www.udemy.com/course/ethicalhackingcourse/,"Joe Parys, Aleksa Tamburkovski, Joe Parys Support",Rating: 4.6 out of 54.6,"2,096",$11.99,Original Price$64.99,13.5 total hours,85 lectures,All Levels,False
Ultimate Ethical Hacking and Penetration Testing (UEH)Learn and Practice the Techniques of Hacking and Penetration TestingRating: 4.6 out of 52061 reviews62 total hours358 lecturesBeginnerCurrent price: $29.99,https://www.udemy.com/course/ultimate-ethical-hacking/,Naga Sai Nikhil,Rating: 4.6 out of 54.6,"2,061",$29.99,,62 total hours,358 lectures,Beginner,False
Full Ethical Hacking CourseLearn all about ethical hacking and penetration testing.Rating: 4.5 out of 52036 reviews15.5 total hours95 lecturesBeginnerCurrent price: $10.99Original price: $64.99,https://www.udemy.com/course/full-ethical-hacking-course/,Liang Yang Loi,Rating: 4.5 out of 54.5,"2,036",$10.99,Original Price$64.99,15.5 total hours,95 lectures,Beginner,False
"The Definitive Ethical Hacking Course - Learn From ScratchLearn the Basics Of Ethical Hacking, Penetration Testing, Wifi HackingRating: 4.0 out of 51874 reviews9 total hours73 lecturesAll LevelsCurrent price: $10.99Original price: $19.99",https://www.udemy.com/course/kali-linux/,Nikhil Parekh,Rating: 4.0 out of 54.0,"1,874",$10.99,Original Price$19.99,9 total hours,73 lectures,All Levels,False
The Complete Ethical Hacker Certification Exam Prep CourseThis Course WILL provide EVERYTHING Needed to allow you to Pass your Ethical Hacking Exam v12Rating: 4.3 out of 51717 reviews16.5 total hours188 lecturesBeginnerCurrent price: $10.99Original price: $69.99,https://www.udemy.com/course/the-complete-ceh-exam-prep-course-become-an-ethical-hacker/,Tim Pierson,Rating: 4.3 out of 54.3,"1,717",$10.99,Original Price$69.99,16.5 total hours,188 lectures,Beginner,False
"Ethical Hacking: Full 60 Hour Red Team & Penetration TestingLearn ethical hacking, penetration testing, Linux tools, C++, cryptography, and real-world cybersecurity strategies NOW!Rating: 4.1 out of 51712 reviews60.5 total hours399 lecturesAll LevelsCurrent price: $9.99Original price: $49.99",https://www.udemy.com/course/the-ultimate-ethical-hacking-linux-and-metasploit-training/,OCSALY Academy | 560.000+ Students,Rating: 4.1 out of 54.1,"1,712",$9.99,Original Price$49.99,60 Hour,399 lectures,All Levels,False
Penetration Testing Fundamentals: A Beginner's GuideBuilding Hands-On Skills for Real-World Penetration TestingRating: 4.4 out of 51685 reviews10.5 total hours71 lecturesAll LevelsCurrent price: $10.99Original price: $64.99,https://www.udemy.com/course/hacking-made-easy-with-hands-on-training/,Prof. K,Rating: 4.4 out of 54.4,"1,685",$10.99,Original Price$64.99,10.5 total hours,71 lectures,All Levels,False
The Complete Penetration Testing BootcampLearn Penetration Testing The Right Way! Learn All The Ethical Hacking & Penetration Testing Techniques Used By HackersRating: 4.5 out of 51214 reviews10.5 total hours65 lecturesAll LevelsCurrent price: $11.99Original price: $49.99,https://www.udemy.com/course/the-complete-ethical-hacking-masterclass/,HackerSploit Academy,Rating: 4.5 out of 54.5,"1,214",$11.99,Original Price$49.99,10.5 total hours,65 lectures,All Levels,False
"Ethical Hacking with Metasploit: Exploit & Post ExploitLearn Ethical Hacking from scratch with Metasploit, exploit vulnerabilities and become a white hat hacker | Ethical 2022Rating: 4.5 out of 51021 reviews5 total hours84 lecturesAll LevelsCurrent price: $11.99Original price: $69.99",https://www.udemy.com/course/ethical-hacking-with-metasploit-exploit-post-exploit/,"Muharrem AYDIN, OAK Academy Team",Rating: 4.5 out of 54.5,"1,021",$11.99,Original Price$69.99,5 total hours,84 lectures,All Levels,False
The RedTeam Blueprint - A Unique Guide To Ethical HackingLearn what it really takes to be an Ethical Hacker for Silicon Valley Companies. The TRUE Blueprint to Ethical Hacking.Rating: 4.5 out of 51655 reviews30.5 total hours268 lecturesAll LevelsCurrent price: $11.99Original price: $64.99,https://www.udemy.com/course/the-redteam-blueprint/,Brandon Dennis,Rating: 4.5 out of 54.5,"1,655",$11.99,Original Price$64.99,30.5 total hours,268 lectures,All Levels,False
Hands-on Penetration Testing Labs 1.0Comprehensive walkthroughs of penetration testing labsRating: 4.5 out of 51508 reviews4.5 total hours18 lecturesIntermediateCurrent price: $10.99Original price: $44.99,https://www.udemy.com/course/kali-linux-hands-on-penetration-testing-labs/,"Jesse K, M.S., OSCP, CEH, Security+, Linux+, Network+, CISSP",Rating: 4.5 out of 54.5,"1,508",$10.99,Original Price$44.99,4.5 total hours,18 lectures,Intermediate,False
"Applied Ethical Hacking and Rules of Engagement40h empirical knowledge of Cyber Security, Penetration Testing, Python Hacking, Kali Linux &amp; Wazuh SIEM on Elastic StackRating: 4.5 out of 51461 reviews40 total hours173 lecturesAll LevelsCurrent price: $10.99Original price: $74.99",https://www.udemy.com/course/applied-ethical-hacking-and-rules-of-engagement/,"Seyed Farshid Miri, Seyed Farhad Miri",Rating: 4.5 out of 54.5,"1,461",$10.99,Original Price$74.99,40 total hours,173 lectures,All Levels,False
"Complete Web Application Hacking & Penetration TestingHacking web applications, hacking websites, bug bounty &amp; penetration testing in my ethical hacking course to be HackerRating: 4.6 out of 51395 reviews9 total hours93 lecturesAll LevelsCurrent price: $10.99Original price: $74.99",https://www.udemy.com/course/complete-web-application-hacking-penetration-testing/,"Muharrem AYDIN, OAK Academy Team",Rating: 4.6 out of 54.6,"1,395",$10.99,Original Price$74.99,9 total hours,93 lectures,All Levels,False
"The Complete Mobile Ethical Hacking CourseLearn how hackers attack phones, mobile applications and mobile devices with latest technology and protect yourself!Rating: 4.1 out of 51356 reviews28 total hours204 lecturesAll LevelsCurrent price: $10.99Original price: $69.99",https://www.udemy.com/course/the-complete-mobile-ethical-hacking-course/,"Codestars • over 2.5 million students worldwide!, Atil Samancioglu",Rating: 4.1 out of 54.1,"1,356",$10.99,Original Price$69.99,28 total hours,204 lectures,All Levels,False
Ultimate Ethical Hacking Boot Camp - Beginner to ProLearn Ethical Hacking from world-famous Hacker Bryan Seely. Learn real hacker secrets from the real thing.Rating: 4.3 out of 51321 reviews4.5 total hours44 lecturesBeginnerCurrent price: $10.99Original price: $19.99,https://www.udemy.com/course/cybersecurity-ultimate-ethical-hacking-boot-camp/,Bryan Seely,Rating: 4.3 out of 54.3,"1,321",$10.99,Original Price$19.99,4.5 total hours,44 lectures,Beginner,False
