title,url,instructor,rating,reviews_count,price,original_price,duration,lectures,level
AMERICAN ENGLISH PRONUNCIATION: Accent Reduction Made EasyStep by Step Guide to Master the American Accent! Taught by Expert AWARD WINNING BROADWAY VOICE COACHRating: 4.7 out of 55817 reviews1.5 total hours41 lecturesAll LevelsCurrent price: $54.99,https://www.udemy.com/course/accent-reduction-american-english-speaking-made-easy/,GB Voice Academy,4.7,"5,817",$54.99,,1.5 total hours,41 lectures,All Levels
American Accent Made Easy - Mastering the American AccentMaster the American Accent quickly and with ease as taught by renowned Hollywood Accent Coach to the STARS.Rating: 4.8 out of 52964 reviews1.5 total hours20 lecturesAll LevelsCurrent price: $54.99,https://www.udemy.com/course/master-the-american-accent/,Ashwin Gore,4.8,"2,964",$54.99,,1.5 total hours,20 lectures,All Levels
AMERICAN ENGLISH PRONUNCIATION: Accent Reduction Made EasyStep by Step Guide to Master the American Accent! Taught by Expert AWARD WINNING BROADWAY VOICE COACHRating: 4.7 out of 55818 reviews1.5 total hours41 lecturesAll LevelsCurrent price: $54.99,https://www.udemy.com/course/accent-reduction-american-english-speaking-made-easy/,GB Voice Academy,4.7,"5,818",$54.99,,1.5 total hours,41 lectures,All Levels
Accent-Reduction/American English Pronunciation PracticeAccess to Accent Assets using multimedia and portfolio powersRating: 4.7 out of 5597 reviews1.5 total hours16 lecturesAll LevelsCurrent price: $39.99,https://www.udemy.com/course/accent-reduction-american-english-pronunciation-practice/,Erol Gokcedag,4.7,597,$39.99,,1.5 total hours,16 lectures,All Levels
5 Days to a Better AccentImprove your Pronunciation Quickly & EasilyRating: 4.3 out of 5414 reviews1.5 total hours6 lecturesExpertCurrent price: $19.99,https://www.udemy.com/course/5-days-to-a-better-accent/,Nicole Kaup,4.3,414,$19.99,,1.5 total hours,6 lectures,Expert
"Accent Reduction Made Fast and EasyThis is a complete guide for English Accent Reduction with Rules, Word and Sentence Examples.Rating: 4.0 out of 5401 reviews1 total hour29 lecturesAll LevelsCurrent price: $19.99",https://www.udemy.com/course/accent-reduction/,"Angelika Blendstrup, Ph.D.",4.0,401,$19.99,,1 total hour,29 lectures,All Levels
Improve Your American Accent - The K Method Accent ReductionAn Engaging 5 Steps Method Used By Foreign Actors. Master Your American Accent Guided by The K Method Creator Now!Rating: 4.1 out of 5292 reviews1.5 total hours13 lecturesAll LevelsCurrent price: $22.99,https://www.udemy.com/course/improve-your-american-accent-the-k-method-accent-reduction/,Andy Krieger,4.1,292,$22.99,,1.5 total hours,13 lectures,All Levels
Parler anglais comme un anglophone – Améliorer son accentApprendre à mieux prononcer en anglais et se faire mieux comprendre – English pronunciation course for francophonesRating: 4.3 out of 5254 reviews3.5 total hours50 lecturesAll LevelsCurrent price: $59.99,https://www.udemy.com/course/perdre-son-accent-en-anglais-niveau-2/,Jennifer Glover,4.3,254,$59.99,,3.5 total hours,50 lectures,All Levels
"The Rhythm & Melody of American English - Part 2Linking, Thought Groups and Pausing, Non-verbal Communication, PitchRating: 4.6 out of 5182 reviews2 total hours15 lecturesExpertCurrent price: $49.99",https://www.udemy.com/course/the-rhythm-melody-of-american-english-part-2/,Nicole Kaup,4.6,182,$49.99,,2 total hours,15 lectures,Expert
"American English Pronunciation: ADVANCED Accent ReductionSound more natural, speak with confidence, and take your American accent to the next levelRating: 4.8 out of 5144 reviews3.5 total hours40 lecturesIntermediateCurrent price: $19.99",https://www.udemy.com/course/american-english-pronunciation-advanced-accent-reduction/,GB Voice Academy,4.8,144,$19.99,,3.5 total hours,40 lectures,Intermediate
American English: Important Sounds for Perfect PronunciationLearn to Speak Like a NativeRating: 4.6 out of 5118 reviews3 total hours22 lecturesExpertCurrent price: $19.99,https://www.udemy.com/course/american-english-important-sounds-for-perfect-pronunciation/,Nicole Kaup,4.6,118,$19.99,,3 total hours,22 lectures,Expert
English Pronunciation and Accent Training CourseLearn Spoken English Rules - Connected Speech and the International Phonetic Alphabet for EnglishRating: 4.0 out of 542 reviews4 total hours81 lecturesIntermediateCurrent price: $24.99,https://www.udemy.com/course/english-speaking-pronunciation-and-accent-training-course/,Gokberk Talu,4.0,42,$24.99,,4 total hours,81 lectures,Intermediate
"American Accent and PhoneticsMaster the American accent,IPA phonetics,Speak English like an American,Accent reduction,American English pronunciationRating: 4.1 out of 534 reviews2.5 total hours76 lecturesAll LevelsCurrent price: $19.99",https://www.udemy.com/course/american-accent-pronunciation-rules-from-scratch/,Zaki Badr,4.1,34,$19.99,,2.5 total hours,76 lectures,All Levels
Received Pronunciation: Student Correction CourseParticipants from various linguistic backgrounds take up the challenge of mastering the RP accent.Rating: 4.8 out of 533 reviews7 total hours73 lecturesAll LevelsCurrent price: $59.99,https://www.udemy.com/course/rpaccent/,Anton H,4.8,33,$59.99,,7 total hours,73 lectures,All Levels
Accent Reduction: English Pronunciation MasteryLearn how to communicate more clearly in English. Accent reduction/accent modification starts with great pronunciation.Rating: 4.1 out of 530 reviews1 total hour91 lecturesAll LevelsCurrent price: $19.99,https://www.udemy.com/course/pronunciationmaster/,Adam Carson,4.1,30,$19.99,,1 total hour,91 lectures,All Levels
American Accent for Mandarin Speakers 101Skills Mandarin Speakers Need to Know for Speaking Clear American EnglishRating: 4.6 out of 530 reviews2 total hours18 lecturesIntermediateCurrent price: $19.99,https://www.udemy.com/course/american-accent-for-mandarin-speakers-101/,Susan Ryan,4.6,30,$19.99,,2 total hours,18 lectures,Intermediate
"Accent Reduction, American Accent TrainingAccent Modification Techniques -  Learn How to Change Your Accent to A Standard American AccentRating: 3.7 out of 526 reviews2.5 total hours40 lecturesAll LevelsCurrent price: $19.99",https://www.udemy.com/course/accent-reduction-american-accent-training/,Brian Cliette,3.7,26,$19.99,,2.5 total hours,40 lectures,All Levels
Russian Tongue Twisters: Accent ReductionWant to sound like a native Russian speaker? Start this course now!Rating: 4.8 out of 520 reviews1.5 total hours6 lecturesAll LevelsCurrent price: $54.99,https://www.udemy.com/course/russian-tongue-twisters-accent-reduction/,Irina Liner,4.8,20,$54.99,,1.5 total hours,6 lectures,All Levels
English Pronunciation: Master the /w/ SoundReceived Pronunciation: The /w/ Consonant SoundRating: 4.9 out of 56 reviews0.5 total hours15 lecturesAll LevelsCurrent price: $19.99,https://www.udemy.com/course/english-w-sound/,Anton H,4.9,6,$19.99,,0.5 total hours,15 lectures,All Levels
90-Day Accent Like A Boss: English Pronunciation MasteryYour Best Accent and Pronunciation in Just 90 Days – British and American TrainingRating: 5.0 out of 51 review6.5 total hours45 lecturesAll LevelsCurrent price: $19.99,https://www.udemy.com/course/accentlikeaboss/,David Rajaraman,5.0,1,$19.99,,6.5 total hours,45 lectures,All Levels
Mastering Accent Reduction - Speak Clearly and ConfidentlyTried & Tested Techniques by Expert Trainer to Excel in English Pronunciation & Understand reasons for Accent VariationsRating: 5.0 out of 51 review4.5 total hours41 lecturesAll LevelsCurrent price: $19.99,https://www.udemy.com/course/mastering-accent-reduction/,"Talent loom, Mounata D Majumdar",5.0,1,$19.99,,4.5 total hours,41 lectures,All Levels
Learn Chinese without accent from PinyinUsing broadcasting and performance techniques to shape your Chinese voiceRating: 0.0 out of 50 reviews6 total hours13 lecturesExpertCurrent price: $19.99,https://www.udemy.com/course/learn-chinese-without-accent-from-pinyin/,Santa Liu,,,$19.99,,6 total hours,13 lectures,Expert
English Pronunciation for Spanish Speakers - curso de inglésCurso de pronunciación de inglés más fácil y más natural - American Accent Training CourseRating: 4.4 out of 5849 reviews2 total hours28 lecturesAll LevelsCurrent price: $39.99,https://www.udemy.com/course/english-pronunciation-for-spanish-speakers/,Jennifer Glover,4.4,849,$39.99,,2 total hours,28 lectures,All Levels
English Pronunciation for French Speakers – Cours d'anglaisExercices de prononciation pour parler anglais plus facilement et plus naturellement  - American Accent Training CourseRating: 4.5 out of 5165 reviews1.5 total hours27 lecturesAll LevelsCurrent price: $19.99,https://www.udemy.com/course/parler-anglais-comme-un-anglophone-maitriser-langlais-cours-intensif/,Jennifer Glover,4.5,165,$19.99,,1.5 total hours,27 lectures,All Levels
"あなたの英語がみるみる変わる！【英語発音の1,2,3】英語で数字を「正しく」発音できると日常会話もネイティヴに近づく！Rating: 4.7 out of 540 reviews1 total hour15 lecturesBeginnerCurrent price: $19.99",https://www.udemy.com/course/123-pronun/,Mayumi Tomizawa,4.7,40,$19.99,,1 total hour,15 lectures,Beginner
「１番変わった！」アメリカで女優をやっていた日本人講師によるプロがやっている英語発音練習講座１英語の発音が通じなかった私が８年かけて「１番変化した発音のコツ」をまとめました。Rating: 4.7 out of 53 reviews1 total hour16 lecturesAll LevelsCurrent price: $19.99,https://www.udemy.com/course/eigohatsuon/,七瀬アリーサ 大人の勉強ch運営,4.7,3,$19.99,,1 total hour,16 lectures,All Levels
"【30日間 喉発音ブートキャンプ】ネイティブの“速いビジネス英語”が""聞き取れて話せる""に変わるリスニング講座もう「単語は分かるのに聞き取れない」は卒業しませんか？リスニング力は「耳」ではなく「喉」と「リズム」で決まる。喉発音×音声変化×ビジネス定番フレーズで、オンライン会議／電話／プレゼンに強い英語耳と発音を30日で手に入れる集中プログラム。Rating: 0.0 out of 50 reviews4 total hours59 lecturesAll LevelsCurrent price: $199.99",https://www.udemy.com/course/momokaenglish6/,英語コーチ ももか,,,$199.99,,4 total hours,59 lectures,All Levels
دليلك لفهم لغة الأفلام الأمريكيةأهم الأسرار لفهم اللهجة الأمريكية والتحدث بهاRating: 4.4 out of 5105 reviews1 total hour11 lecturesIntermediate,https://www.udemy.com/course/accentreduction/,Ahmed Elbasamy,4.4,105,,,1 total hour,11 lectures,Intermediate
