title,url,instructor,rating,reviews_count,price,original_price,duration,lectures,level
Reiki Grandmaster Teacher Level 5-22 ACCREDITED CertificateIAHH membership is our complimentary gift to you.Rating: 4.9 out of 5161 reviews2 total hours31 lecturesAll LevelsCurrent price: $29.99,https://www.udemy.com/course/reiki-grandmaster-teacher-level-5-22-accredited-certificate/,MASTER METE,4.9,161,$29.99,,2 total hours,31 lectures,All Levels
"Learn To Focus: Meditation & Mindfulness For ADHDDon't ""cure"" your ADHD - transform it into a superpower!Rating: 4.4 out of 5718 reviews1 total hour18 lecturesBeginnerCurrent price: $64.99",https://www.udemy.com/course/meditation-for-adhd/,Kevin Ellerton,4.4,718,$64.99,,1 total hour,18 lectures,Beginner
Crystal Reiki Master/Teacher CertificationStep into your power and become a Certified Crystal Reiki MasterRating: 4.7 out of 58689 reviews2 total hours38 lecturesExpertCurrent price: $74.99,https://www.udemy.com/course/crystal-reiki/,Lisa Powers,4.7,"8,689",$74.99,,2 total hours,38 lectures,Expert
"Reiki Level I, II and Master/Teacher CertificationLearn Reiki Levels 1, 2 and Master Level to become a Certified Traditional Usui Reiki Practitioner/InstructorRating: 4.8 out of 558049 reviews6.5 total hours69 lecturesAll LevelsCurrent price: $69.99",https://www.udemy.com/course/reikicourse/,Lisa Powers,4.8,"58,049",$69.99,,6.5 total hours,69 lectures,All Levels
"Complete Reiki Level 1, 2, 3 & Master/Teacher CertificationLearn to Heal Yourself, Friends, Family, Animals & more while Channeling Reiki with This Spiritual Energy Healing SystemRating: 4.8 out of 51629 reviews11 total hours98 lecturesAll LevelsCurrent price: $59.99",https://www.udemy.com/course/reiki-healing-level-1-2-3-mastership-teacher-online-course-system/,Lisa Mohr,4.8,"1,629",$59.99,,11 total hours,98 lectures,All Levels
"Reiki Level I, II + Master Certificate Course Energy HealingUsui Reiki 1, 2 Master Certification Course - Heal Yourself, Family, Friends, Clients and Pets with Reiki Energy HealingRating: 4.8 out of 532322 reviews4 total hours103 lecturesAll LevelsCurrent price: $69.99",https://www.udemy.com/course/reiki-master-certification-energy-healing/,Melissa Crowhurst,4.8,"32,322",$69.99,,4 total hours,103 lectures,All Levels
"Reiki Levels 1 & 2In addition to learning Reiki, you will also receive valuable information in order to completely transform your life.Rating: 4.4 out of 585 reviews1.5 total hours20 lecturesBeginnerCurrent price: $19.99",https://www.udemy.com/course/reiki-levels-1-2/,Laura Waterman,4.4,85,$19.99,,1.5 total hours,20 lectures,Beginner
Holy Fire Reiki Master SystemMaster the powerful Holy Fire Reiki system to elevate your healing practice and spiritual growth.Rating: 4.7 out of 5169 reviews3 total hours35 lecturesAll LevelsCurrent price: $39.99,https://www.udemy.com/course/reiki-holy-fire-111-level-1-level-2-and-master-level/,Beti Paunoska,4.7,169,$39.99,,3 total hours,35 lectures,All Levels
The Complete ACCREDITED Reiki Master / Teacher CertificationReiki practitioner/ instructor through step-by-step Reiki certification course with Color Reiki and Crystal Reiki.Rating: 4.7 out of 5551 reviews1.5 total hours34 lecturesAll LevelsCurrent price: $64.99,https://www.udemy.com/course/accredited-reiki-master-teacher-certification-all-levels-color-crystal/,"Prof. Krishna N. Sharma, Ph.D., Virtued Academy International, UniSkill Academy",4.7,551,$64.99,,1.5 total hours,34 lectures,All Levels
REIKI HOLY FIRE - LEVEL 3 - MASTER PRACTITIONER | TEACHERElevate your Reiki Journey by Leading and Teaching others the Incredible Gift of Reiki Healing as a Master Teacher.Rating: 4.8 out of 5284 reviews6.5 total hours52 lecturesExpertCurrent price: $54.99,https://www.udemy.com/course/reiki-holy-fire-111-master-level-professional-accredited/,Jennifer White Deeply Rooted Journey Spiritual Academy,4.8,284,$54.99,,6.5 total hours,52 lectures,Expert
"Reiki Space Clearing Certification Course - Energy HealingRid Negative Energy In Homes, Rooms, Workplaces & More! Use Reiki Energy Healing To Clear Your Own Spaces Or Others!Rating: 4.7 out of 51531 reviews2 total hours48 lecturesBeginnerCurrent price: $59.99",https://www.udemy.com/course/reiki-space-clearing/,Melissa Crowhurst,4.7,"1,531",$59.99,,2 total hours,48 lectures,Beginner
Past Life Reiki and Time Reiki - two courses in oneTwo Master courses in oneRating: 5.0 out of 512 reviews1.5 total hours21 lecturesAll LevelsCurrent price: $19.99,https://www.udemy.com/course/past-life-reiki-and-time-reiki-two-courses-in-one/,"Advanced Holistic Academy - Accademia Holistica Avanzata, Berardino Nardella",5.0,12,$19.99,,1.5 total hours,21 lectures,All Levels
Crystal Healing Certificate Course - Energy Healing StonesThis Energy Healing Course Is Ideal To Learn The Power Of Crystals! Learn How Crystal Healing Can Help You And Others!Rating: 4.7 out of 53550 reviews2 total hours50 lecturesAll LevelsCurrent price: $64.99,https://www.udemy.com/course/crystal-healing/,Melissa Crowhurst,4.7,"3,550",$64.99,,2 total hours,50 lectures,All Levels
Certification in Crystal Reiki - Master / Teacher TrainingInternationally Accredited Crystal Reiki Masterclass | Become a Certified Crystal Reiki Master / TeacherRating: 4.9 out of 5146 reviews2.5 total hours31 lecturesAll LevelsCurrent price: $54.99,https://www.udemy.com/course/crystal-reiki-master-teacher-training-diploma-diploma-certification/,"Prof. Krishna N. Sharma, Ph.D., Virtued Academy International, UniSkill Academy",4.9,146,$54.99,,2.5 total hours,31 lectures,All Levels
"Reiki Level I, II, III & Master/Teacher Certification CourseBecome a Certified Usui Reiki Master - Heal Yourself and Others, Animals and Plants through Energy Healing. Teach Reiki!Rating: 4.5 out of 5718 reviews5 total hours266 lecturesAll LevelsCurrent price: $49.99",https://www.udemy.com/course/reiki-level-i-ii-iii-masterteacher-certification-course/,Dr. Mehmet Tenzin Cesmeci,4.5,718,$49.99,,5 total hours,266 lectures,All Levels
"Reiki Level I, II and Master/Teacher CertificationLearn Reiki Levels 1, 2 and Master Level to become a Certified Traditional Usui Reiki Practitioner/InstructorRating: 4.8 out of 558051 reviews6 total hours69 lecturesAll LevelsCurrent price: $69.99",https://www.udemy.com/course/reikicourse/,Lisa Powers,4.8,"58,051",$69.99,,6 total hours,69 lectures,All Levels
"Reiki Level I, II + Master Certificate Course Energy HealingUsui Reiki 1, 2 Master Certification Course - Heal Yourself, Family, Friends, Clients and Pets with Reiki Energy HealingRating: 4.8 out of 532324 reviews4 total hours103 lecturesAll LevelsCurrent price: $69.99",https://www.udemy.com/course/reiki-master-certification-energy-healing/,Melissa Crowhurst,4.8,"32,324",$69.99,,4 total hours,103 lectures,All Levels
QUANTUM REIKI: Level 1 - Healer Certification by Antojai®Learn the FULL POWER OF REIKI!Rating: 4.8 out of 53274 reviews6 total hours34 lecturesAll LevelsCurrent price: $79.99,https://www.udemy.com/course/quantum-reiki-master-certification/,Ascended Master Antojai | Axél Carrasquillo Msc.D.,4.8,"3,274",$79.99,,6 total hours,34 lectures,All Levels
Reiki and Colour TherapyExpanding Your AwarenessRating: 4.7 out of 51635 reviews2.5 total hours47 lecturesAll LevelsCurrent price: $64.99,https://www.udemy.com/course/reiki-and-colour-therapy/,"Lisa Powers, Libby Seery",4.7,"1,635",$64.99,,2.5 total hours,47 lectures,All Levels
"Complete Reiki Level 1, 2, 3 & Master/Teacher CertificationLearn to Heal Yourself, Friends, Family, Animals & more while Channeling Reiki with This Spiritual Energy Healing SystemRating: 4.8 out of 51630 reviews11 total hours98 lecturesAll LevelsCurrent price: $59.99",https://www.udemy.com/course/reiki-healing-level-1-2-3-mastership-teacher-online-course-system/,Lisa Mohr,4.8,"1,630",$59.99,,11 total hours,98 lectures,All Levels
Build Your Ideal Reiki BusinessA step by step guide to becoming a professional Reiki practitionerRating: 4.8 out of 51422 reviews2.5 total hours26 lecturesAll LevelsCurrent price: $64.99,https://www.udemy.com/course/reiki-business-course/,Lisa Powers,4.8,"1,422",$64.99,,2.5 total hours,26 lectures,All Levels
Advanced Reiki Master Teacher Certificate & Course MaterialDevelop Your Reiki Master Teacher Skills & Get Certified! Learn How to Teach Others - Advanced Course for Reiki MastersRating: 4.8 out of 51238 reviews2 total hours43 lecturesIntermediateCurrent price: $59.99,https://www.udemy.com/course/reiki-master-teacher-certification/,Melissa Crowhurst,4.8,"1,238",$59.99,,2 total hours,43 lectures,Intermediate
Reiki Distance Healing Specialist Certification CourseComprehensive yet simple Distance Energy Healing steps for new and experienced healers | Ideal for Reiki PractitionersRating: 4.8 out of 51117 reviews2 total hours52 lecturesAll LevelsCurrent price: $64.99,https://www.udemy.com/course/reiki-distance-healing-specialist/,Melissa Crowhurst,4.8,"1,117",$64.99,,2 total hours,52 lectures,All Levels
SEKHMET REIKI - Internationally Accredited by IAOTHAncient Egyptian Art of HealingRating: 4.5 out of 51015 reviews3 total hours20 lecturesAll LevelsCurrent price: $74.99,https://www.udemy.com/course/sekhmet-reiki/,Thoth Wisdom,4.5,"1,015",$74.99,,3 total hours,20 lectures,All Levels
"Reiki Solas® 1&2 Practitioner Certification Energy HealingLearn Reiki Solas® 1&2, get certified in Reiki energy healing & chakra cleansing & be a spiritual healing practitioner.Rating: 4.9 out of 5801 reviews10 total hours71 lecturesAll LevelsCurrent price: $74.99",https://www.udemy.com/course/reiki-solas-level-1and2-preparation-degree/,YOGI RICKY MATHIESON,4.9,801,$74.99,,10 total hours,71 lectures,All Levels
Learn Traditional Japanese Reiki –1st Degree Beginner/ShodenDiscover the 3 pillars of Reiki and receive Lifetime Attunement to this amazing energy source.Rating: 4.9 out of 5700 reviews3.5 total hours113 lecturesBeginnerCurrent price: $74.99,https://www.udemy.com/course/learn-traditional-japanese-reiki-1st-degree-beginner-shoden/,Joanna Bardol,4.9,700,$74.99,,3.5 total hours,113 lectures,Beginner
"REIKI: Reiki I, 2 & Master Certification!Complete Reiki Level 1, 2 & reiki Master Level , Become Usui Reiki Practitioner/Teacher, Get Reiki Master Certification!Rating: 4.7 out of 5698 reviews6 total hours110 lecturesAll LevelsCurrent price: $69.99",https://www.udemy.com/course/reiki-reikicourse-master-certification-course/,Learn Online,4.7,698,$69.99,,6 total hours,110 lectures,All Levels
"Kundalini Reiki Master (levels 1, 2 and 3)A course for becoming a Kundalini Reiki Master, with an internationally recognized certificate.Rating: 4.8 out of 5686 reviews2 total hours39 lecturesBeginnerCurrent price: $64.99",https://www.udemy.com/course/kundalini-reiki-master-levels-1-2-and-3/,"Advanced Holistic Academy - Accademia Holistica Avanzata, Berardino Nardella",4.8,686,$64.99,,2 total hours,39 lectures,Beginner
