title,url,instructor,rating,reviews_count,price,original_price,duration,lectures,level
"Career Hacking: The Ultimate Job Search Course (Now w/ AI!)Boost your resume, LinkedIn, cover letter, interviewing & networking skills. Now with AI prompts for ChatGPT & Claude!Rating: 4.7 out of 59905 reviews6.5 total hours130 lecturesAll LevelsCurrent price: $69.99",https://www.udemy.com/course/golden-gate-bridge/,"Davis Jones, Eazl.ai Courseware, Ludell Jones",4.7,"9,905",$69.99,,6.5 total hours,130 lectures,All Levels
P.O.W.E.R. : Proven Interview System to crack your DREAM jobLand the Offer — Learn the Interview Method That Turns Nerves into Confidence and Conversations into JobsRating: 4.3 out of 5645 reviews2 total hours14 lecturesAll LevelsCurrent price: $19.99,https://www.udemy.com/course/ace-every-job-interview-master-blueprint-and-get-your-dream-job/,"Susmita Dutta, Ash Akshay Goel",4.3,645,$19.99,,2 total hours,14 lectures,All Levels
"Top-1% Resume Writing: Write A Resume, Cover Letter, CVWrite a great resume, CV, cover letter | Job interview prep | Job search with your resume on job sites and LinkedInRating: 4.7 out of 51214 reviews9 total hours116 lecturesBeginnerCurrent price: $54.99",https://www.udemy.com/course/how-to-write-a-resume-and-cover-letter/,Alex Genadinik,4.7,"1,214",$54.99,,9 total hours,116 lectures,Beginner
"Land Your Dream Job: English Skills for Career SuccessAdvance Your English for Career Development: Write Strong CVs, Succeed in Interviews & Confidently Communicate at WorkRating: 4.8 out of 554 reviews2 total hours14 lecturesAll LevelsCurrent price: $19.99",https://www.udemy.com/course/land-your-dream-job-english-skills-for-cvs-interviews/,Natalie Marchant,4.8,54,$19.99,,2 total hours,14 lectures,All Levels
Create an Explosive ResumeLearn how to write the resume that will get you the interview.Rating: 4.7 out of 54440 reviews34 total mins9 lecturesAll LevelsCurrent price: $39.99,https://www.udemy.com/course/create-an-explosive-resume/,Marc LeFevre,4.7,"4,440",$39.99,,,9 lectures,All Levels
Write The Ultimate Resume or CV! LinkedIn > ATS > InterviewGet The Job! Master writing resumes/CVs/cover letters and pass ATS and Wow recruiters through targeting via LinkedIn.Rating: 4.8 out of 558 reviews5.5 total hours54 lecturesAll LevelsCurrent price: $19.99,https://www.udemy.com/course/the-ultimate-resume-or-cv-writing-course-from-linkedin-ats-interview/,"Michael James (PSM I, PSM II, PSM III, PSPO 1, PSPO II, SPS certified)",4.8,58,$19.99,,5.5 total hours,54 lectures,All Levels
"Job Search 2025: With LinkedIn, Resume CV & Networking TipsUse LinkedIn, job sites, CV resume and networking strategies in the 2025 job search with this practical hands-on course.Rating: 4.8 out of 58 reviews4 total hours33 lecturesAll LevelsCurrent price: $19.99",https://www.udemy.com/course/ultimate-modern-job-search-course-linkedin-resume-cv-networking-tips/,"Michael James (PSM I, PSM II, PSM III, PSPO 1, PSPO II, SPS certified)",4.8,8,$19.99,,4 total hours,33 lectures,All Levels
"Job Search Mastery, Interviewing, Resume, LinkedIn, TestingInterview Success (Instructor Demo Questions), Screening Tests, Build LinkedIn, Profile, Resume, CV, Job Search & MoreRating: 4.7 out of 5257 reviews12.5 total hours170 lecturesAll LevelsCurrent price: $64.99",https://www.udemy.com/course/job-search-interviewing-resume-linkedin-cv-testing-master/,"Steve Ballinger, MBA",4.7,257,$64.99,,12.5 total hours,170 lectures,All Levels
"Proven Results Resumes: The ONLY Job Search Course You NeedThe Ultimate Guide to Crafting, Optimizing & Leveraging AI for Standout Resumes and a Successful Job SearchRating: 4.7 out of 5152 reviews21.5 total hours77 lecturesAll LevelsCurrent price: $19.99",https://www.udemy.com/course/proven-results-resumes/,Aaron Hillyer,4.7,152,$19.99,,21.5 total hours,77 lectures,All Levels
Top 1% Resume and CV Writing│Winning Job Search Resume & CVWrite a wining Resume & CV. Learn from a HR Specialist and Founder of TopResumess. Free templates and examples included.Rating: 4.8 out of 515 reviews7 total hours78 lecturesAll LevelsCurrent price: $19.99,https://www.udemy.com/course/top-1-resume-and-cv-writingcreate-a-winning-resume-and-cv/,Eshaan Rao,4.8,15,$19.99,,7 total hours,78 lectures,All Levels
"Interview, CV and portfolio - get the HIGHEST PAYING jobLearn how to make the perfect CV, portfolio and interview preparation from an engineer who had multiple high paid jobsRating: 4.7 out of 524 reviews6.5 total hours57 lecturesIntermediateCurrent price: $19.99",https://www.udemy.com/course/interview-cv-and-portfolio-secure-your-dream-job/,Alexander Consulting,4.7,24,$19.99,,6.5 total hours,57 lectures,Intermediate
Effective Job SearchingHow to have a  Successful Job SearchRating: 4.7 out of 516 reviews7.5 total hours90 lecturesAll LevelsCurrent price: $19.99,https://www.udemy.com/course/the-job-hunt-demystified/,Luki Danukarjanto,4.7,16,$19.99,,7.5 total hours,90 lectures,All Levels
The Complete IT Job Search Course - Land Your Dream IT JobLaunch Your IT Job Search On the Right Track! Master the IT World's LinkedIn Resume CV Writing & Interviewing SkillsRating: 4.6 out of 5265 reviews14.5 total hours450 lecturesAll LevelsCurrent price: $64.99,https://www.udemy.com/course/the-complete-it-job-search-course-land-your-dream-it-job/,"TJ Walker, Imran Afzal, Media Training Worldwide Digital",4.6,265,$64.99,,14.5 total hours,450 lectures,All Levels
"Career Hacking: The Ultimate Job Search Course (Now w/ AI!)Boost your resume, LinkedIn, cover letter, interviewing &amp; networking skills. Now with AI prompts for ChatGPT &amp; Claude!Rating: 4.7 out of 59905 reviews6.5 total hours130 lecturesAll LevelsCurrent price: $69.99",https://www.udemy.com/course/golden-gate-bridge/,"Davis Jones, Eazl.ai Courseware, Ludell Jones",4.7,"9,905",$69.99,,6.5 total hours,130 lectures,All Levels
Create an Explosive ResumeLearn how to write the resume that will get you the interview.Rating: 4.7 out of 54440 reviews0.5 total hours9 lecturesAll LevelsCurrent price: $39.99,https://www.udemy.com/course/create-an-explosive-resume/,Marc LeFevre,4.7,"4,440",$39.99,,0.5 total hours,9 lectures,All Levels
CV Writing: A Complete Guide PLUS CV Writing With ChatGPTWrite An Amazing CV / Resume To Get The Job You Want PLUS ChatGPT CV Tips PLUS Artificial Intelligence InsightsRating: 4.3 out of 51440 reviews22.5 total hours218 lecturesBeginnerCurrent price: $44.99,https://www.udemy.com/course/cv-masterclass/,"Peter Alkema, Tracey Ashington",4.3,"1,440",$44.99,,22.5 total hours,218 lectures,Beginner
P.O.W.E.R Resume System: Proven system to get job interviewsWrite Resumes That Work — Get Interviews in 6 Seconds or Less Using the Proven P.O.W.E.R MethodRating: 4.1 out of 5891 reviews1.5 total hours20 lecturesAll LevelsCurrent price: $22.99,https://www.udemy.com/course/power-resume-and-cv-writing-that-lands-job-interviews/,"Susmita Dutta, Ash Akshay Goel",4.1,891,$22.99,,1.5 total hours,20 lectures,All Levels
Ultimate Resume Makeover: Create Worldclass CV OvernightTransform Your Resume / CV From Ordinary To Worldclass Overnight… And Get Your Dream Job Anywhere In The WorldRating: 4.3 out of 5678 reviews2.5 total hours20 lecturesAll LevelsCurrent price: $19.99,https://www.udemy.com/course/ultimate-resume-makeover/,Waqas Hassan,4.3,678,$19.99,,2.5 total hours,20 lectures,All Levels
Build the Best Resume+LinkedIn Profile:by Award Winning ProfBy an Award Winning MBA Prof. Who Successfully Changed Careers from Goldman to Consulting to VC to Hedge Funds to Tech.Rating: 4.5 out of 5530 reviews3.5 total hours68 lecturesAll LevelsCurrent price: $59.99,https://www.udemy.com/course/build-the-best-resume-linkedin-profile-by-mba-award-winning-prof/,Chris Haroun | 1.5 Million Students | #1 Best Selling Business & Finance Prof.,4.5,530,$59.99,,3.5 total hours,68 lectures,All Levels
"Best Resume, CV, Application Covering Letter writing courseAI Role Play to learn ats friendly CV building for job search using LinkedIn Profile; Resume and Letter writing FormatsRating: 4.3 out of 5445 reviews5 total hours49 lecturesAll LevelsCurrent price: $34.99",https://www.udemy.com/course/how-to-prepare-a-great-cv/,"Arun Singhal B-Tech, MBA (IIM-B),Unilever, J&J, Danone, IIMU, Cello",4.3,445,$34.99,,5 total hours,49 lectures,All Levels
How to Write a ResumeWrite a Resume that Will Land You the InterviewRating: 4.6 out of 5378 reviews0.5 total hours10 lecturesBeginnerCurrent price: $19.99,https://www.udemy.com/course/howtowritearesume/,Lindsay Mustain,4.6,378,$19.99,,0.5 total hours,10 lectures,Beginner
"The Complete Resume and CV Writing Course: Get the Ideal JobLearn the Art and Science of Resume and CV Writing - Job Search Skills, LinkedIn and Interview Skills all IncludedRating: 4.3 out of 5323 reviews12 total hours363 lecturesAll LevelsCurrent price: $54.99",https://www.udemy.com/course/-complete-resume-cv-writing-course/,"TJ Walker, Kathryn Troutman, Media Training Worldwide Digital",4.3,323,$54.99,,12 total hours,363 lectures,All Levels
Mastering Your Resume Made Easy Training TutorialLand that perfect interview with a professional resume. Everything you need to know.Rating: 4.1 out of 5297 reviews1.5 total hours33 lecturesAll LevelsCurrent price: $19.99,https://www.udemy.com/course/mastering-your-resume-made-easy-training-tutorial/,"TeachUcomp, Inc.",4.1,297,$19.99,,1.5 total hours,33 lectures,All Levels
Writing Winning Resume / CV for your Dream JobWrite a Resume that speaks directly to your target audience and line you up for that job you want to land!Rating: 4.4 out of 5277 reviews1.5 total hours18 lecturesAll LevelsCurrent price: $34.99,https://www.udemy.com/course/writing-winning-resume-cv-for-your-dream-job/,Upskill Labs,4.4,277,$34.99,,1.5 total hours,18 lectures,All Levels
"Resume Writing - Your Ultimate Step-by-Step Resume GuideA detailed guide for effective resume writing. Write a resume that lands interviews, getting your foot in the doorRating: 4.5 out of 5266 reviews2.5 total hours31 lecturesAll LevelsCurrent price: $19.99",https://www.udemy.com/course/beaconpoint-resumewritingcourse/,Katie Chambers,4.5,266,$19.99,,2.5 total hours,31 lectures,All Levels
Resume Writing: Building CV That Gets SHORTLISTEDBuilding the killer resume that gets shortlisted and understanding why most resumes get rejected.Rating: 4.2 out of 5259 reviews2.5 total hours16 lecturesIntermediateCurrent price: $19.99,https://www.udemy.com/course/resume-cv/,Sankalp Chhabra,4.2,259,$19.99,,2.5 total hours,16 lectures,Intermediate
The 60 Minute Masterclass on Writing Effective Resumes & CVsA course loaded with all the tools and resources to make your Resume / CVRating: 4.2 out of 5234 reviews1 total hour8 lecturesBeginnerCurrent price: $19.99,https://www.udemy.com/course/the-60-minute-masterclass-on-writing-effective-resumes-cvs/,Tanaya Acharekar- Mohe,4.2,234,$19.99,,1 total hour,8 lectures,Beginner
The Ultimate Guide to a Product Manager ResumeCreate a Resume that lands you Product Manager interviewsRating: 4.6 out of 5228 reviews3.5 total hours14 lecturesAll LevelsCurrent price: $49.99,https://www.udemy.com/course/rocking-your-product-manager-resume/,Diego Granados,4.6,228,$49.99,,3.5 total hours,14 lectures,All Levels
Resume Masterclass - Professional Interview Magnet SecretsAdvance resume makeover proven tactics that gets you into every interviewRating: 4.4 out of 5189 reviews1.5 total hours13 lecturesIntermediateCurrent price: $19.99,https://www.udemy.com/course/resume-masterclass-professional-interview-magnet-secrets/,Jong Sontze,4.4,189,$19.99,,1.5 total hours,13 lectures,Intermediate
Skills to Pay the BillsResume Writing & Interviewing Techniques to compete for good paying jobs. Bonus: Time Management trainingRating: 4.5 out of 5179 reviews0.5 total hours15 lecturesBeginnerCurrent price: $19.99,https://www.udemy.com/course/skills-to-pay-the-bills/,David Naylor,4.5,179,$19.99,,0.5 total hours,15 lectures,Beginner
The Ultimate Resume Writing Guide: Crafting a Winning EdgeUnderstanding the Importance  of Your ResumeRating: 3.4 out of 5160 reviews1 total hour7 lecturesAll LevelsCurrent price: $19.99,https://www.udemy.com/course/what-must-be-in-your-resume/,Prabh Kirpa Classes,3.4,160,$19.99,,1 total hour,7 lectures,All Levels
ChatGPT 1 Hour CV & Cover Letter Writing Crash CourseLearn to write an ATS-friendly CV and cover letter in under 10 minutes using ChatGPT to land 10x more job interviews!Rating: 4.3 out of 5153 reviews1 total hour9 lecturesBeginnerCurrent price: $19.99,https://www.udemy.com/course/1-hour-cv-cover-letter-writing-crash-course-using-chatgpt/,Adrian Au,4.3,153,$19.99,,1 Hour,9 lectures,Beginner
"Proven Results Resumes: The ONLY Job Search Course You NeedThe Ultimate Guide to Crafting, Optimizing &amp; Leveraging AI for Standout Resumes and a Successful Job SearchRating: 4.7 out of 5152 reviews21.5 total hours77 lecturesAll LevelsCurrent price: $19.99",https://www.udemy.com/course/proven-results-resumes/,Aaron Hillyer,4.7,152,$19.99,,21.5 total hours,77 lectures,All Levels
CV / Resume for Experienced & FreshersA comprehensive guide on how you can build a better resumeRating: 4.5 out of 5142 reviews1 total hour11 lecturesAll LevelsCurrent price: $19.99,https://www.udemy.com/course/cv-resume-for-experienced-freshers/,Shatadip Majumder,4.5,142,$19.99,,1 total hour,11 lectures,All Levels
Resume Success Formula: Create a Resume That Gets Results3 Simple Steps to Writing a Resume That Gets Interviews - Created by a Human Resources Professional & Resume WriterRating: 4.7 out of 5133 reviews5.5 total hours62 lecturesAll LevelsCurrent price: $54.99,https://www.udemy.com/course/resume-success-formula/,Vida Thomson,4.7,133,$54.99,,5.5 total hours,62 lectures,All Levels
2020 Complete Resume Writing CV Course- Land Job Interviews!*Top Selling* Most Compact Course:  Learn Resume Writing (CV) tactics to use to land job interviews (Samples included)Rating: 4.0 out of 5113 reviews0.5 total hours24 lecturesAll LevelsCurrent price: $19.99,https://www.udemy.com/course/completeresumeguide/,Jake Coo,4.0,113,$19.99,,0.5 total hours,24 lectures,All Levels
Ultimate Resume Makeover Course: Get Your Dream JobGet the interviews that you deserve by making these changes to your resumeRating: 4.2 out of 5108 reviews1 total hour16 lecturesAll LevelsCurrent price: $19.99,https://www.udemy.com/course/ultimate-resume-makeover-course-get-your-dream-job/,Thomas White,4.2,108,$19.99,,1 total hour,16 lectures,All Levels
Recruiter Reveals: How to Write a Professional CVLearn the biggest mistakes that job candidates make in their CVs / Resumes and what you can do to stand out in your CVRating: 4.2 out of 5105 reviews1 total hour11 lecturesAll LevelsCurrent price: $29.99,https://www.udemy.com/course/create-the-perfect-cv/,Tom Wiztek,4.2,105,$29.99,,1 total hour,11 lectures,All Levels
"Resume/CV, cover letter, interviewWhen you decide to look for your dream job, remember this course - I'll be here for you...Rating: 4.7 out of 585 reviews1.5 total hours14 lecturesAll LevelsCurrent price: $89.99",https://www.udemy.com/course/career-planning-mitchell/,Dr Peter J Mitchell,4.7,85,$89.99,,1.5 total hours,14 lectures,All Levels
"The Complete CV Writing & Tailoring MasterclassWrite a Job-Winning Resume That Gets Noticed, Passes ATS, and Lands InterviewsRating: 4.5 out of 584 reviews2 total hours35 lecturesAll LevelsCurrent price: $19.99",https://www.udemy.com/course/the-complete-cv-writing-tailoring-masterclass/,"Vipesh Singla , MBA, Certified  SAFe Agile Coach, Tony McBride",4.5,84,$19.99,,2 total hours,35 lectures,All Levels
Resume Writing - The Ultimate Resume Writing CourseWrite an amazing resume that gets attention and helps you get the job you want. By a top professional resume writer.Rating: 4.2 out of 580 reviews0.5 total hours15 lecturesAll LevelsCurrent price: $19.99,https://www.udemy.com/course/resume-writing-ultimate-resume-writing-course/,"Dave Espino, James Lynch",4.2,80,$19.99,,0.5 total hours,15 lectures,All Levels
Applicant Tracking System: The Secret to Dominate Job SearchMaster Job Search | Beat ATS | Optimize Resume | Maximize Keywords | Avoid Kick-out Qs | Avoid Rejection Emails | PDUsRating: 4.3 out of 579 reviews0.5 total hours12 lecturesIntermediateCurrent price: $44.99,https://www.udemy.com/course/applicant-tracking-system/,"Advanced Innovation Group Pro Excellence (AIGPE), Paul Connell",4.3,79,$44.99,,0.5 total hours,12 lectures,Intermediate
"Get a Job with Great EnglishEnglish Job Application Writing - Write Resume/CV, Cover Letter and SEVEN types of Emails to CompaniesRating: 4.8 out of 574 reviews3.5 total hours5 lecturesIntermediateCurrent price: $44.99",https://www.udemy.com/course/english-resume-writing/,Francis Carlisle: Last Minute English,4.8,74,$44.99,,3.5 total hours,5 lectures,Intermediate
Resume Mastery: Crafting Your  Career SuccessYour Resume's Lifespan:  Keeping It Fresh and Relevant  Over TimeRating: 3.9 out of 573 reviews1 total hour5 lecturesAll LevelsCurrent price: $19.99,https://www.udemy.com/course/13-useful-resume-writing-tips/,Prabh Kirpa Classes,3.9,73,$19.99,,1 total hour,5 lectures,All Levels
